post_id,created_at,content,content_type,source,url,score
1ih0whs,1738618923.0,Shocking news! Amsterdam Lelylaan ranked at 380 out of 393 stations in travelers,post,reddit,https://i.redd.it/hdtbaczouzge1.jpeg,163
b8kitu,1554218148.0,Is it me or are 9292 and Google Map schedules completely off for travel in Amsterdam/Netherlands?,post,reddit,https://www.reddit.com/r/Amsterdam/comments/b8kitu/is_it_me_or_are_9292_and_google_map_schedules/,23
efjkc4,1577296976.0,"I need lyrics for this music, badly. Anyone can help?",post,reddit,https://www.reddit.com/r/dutch/comments/efjkc4/i_need_lyrics_for_this_music_badly_anyone_can_help/,15
1o2hojd,1760043430.0,Rebhuhn (Partridge) voted for Bird of the Year 2026 in Germany,post,reddit,https://i.redd.it/fpu49pvqg5uf1.jpeg,97
1kcj0l3,1746131962.0,"Man doodgeschoten op terras van hotel in Rijswijk, verdachte op de vlucht",post,reddit,https://nos.nl/l/2565698,20
1nbhate,1757316509.0,Sanne borst SB real estate agent on Facebook...reviews?,post,reddit,https://www.reddit.com/r/NetherlandsHousing/comments/1nbhate/sanne_borst_sb_real_estate_agent_on/,0
1hb3o0e,1733842836.0,Polakweg,post,reddit,https://www.reddit.com/r/NetherlandsHousing/comments/1hb3o0e/polakweg/,1
1ei7frr,1722597409.0,Looking for good notaris for Den haag/Rijswijk,post,reddit,https://www.reddit.com/r/NetherlandsHousing/comments/1ei7frr/looking_for_good_notaris_for_den_haagrijswijk/,2
1dzlmb6,1720581477.0,Room-apartment-Studio to rent.,post,reddit,https://www.reddit.com/r/NetherlandsHousing/comments/1dzlmb6/roomapartmentstudio_to_rent/,0
1dmkn0w,1719144256.0,Renovation company recommendation,post,reddit,https://www.reddit.com/r/NetherlandsHousing/comments/1dmkn0w/renovation_company_recommendation/,3
1cj4xxw,1714730668.0,Polakweg 15,post,reddit,https://www.reddit.com/r/NetherlandsHousing/comments/1cj4xxw/polakweg_15/,3
1cgtmy4,1714485818.0,Ocarinalaan area review,post,reddit,https://www.reddit.com/r/NetherlandsHousing/comments/1cgtmy4/ocarinalaan_area_review/,0
17968x4,1697463697.0,Living between Amsterdam and Den Haag,post,reddit,https://www.reddit.com/r/NetherlandsHousing/comments/17968x4/living_between_amsterdam_and_den_haag/,12
1nstzgt,1759080063.0,Renting an apartment,post,reddit,https://www.reddit.com/r/Netherlands/comments/1nstzgt/renting_an_apartment/,0
1g30e3q,1728855094.0,Renting a truck in NL,post,reddit,https://www.reddit.com/r/Netherlands/comments/1g30e3q/renting_a_truck_in_nl/,2
1fxec2b,1728213956.0,How to avoid making a mistake of turning into tram lane here?,post,reddit,https://www.reddit.com/r/Netherlands/comments/1fxec2b/how_to_avoid_making_a_mistake_of_turning_into/,15
1fh8ftn,1726391571.0,Moving within the Netherlands,post,reddit,https://www.reddit.com/r/Netherlands/comments/1fh8ftn/moving_within_the_netherlands/,0
1d3gfi9,1717000309.0,Advanced Driving Lessons For New License Holder,post,reddit,https://www.reddit.com/r/Netherlands/comments/1d3gfi9/advanced_driving_lessons_for_new_license_holder/,0
1apgwft,1707787147.0,I got scammed with renting out an apartment,post,reddit,https://i.redd.it/djrb6ouz79ic1.jpeg,658
18c8rz5,1701882781.0,Failed my practical exam yesterday.,post,reddit,https://www.reddit.com/r/Netherlands/comments/18c8rz5/failed_my_practical_exam_yesterday/,0
1796t5b,1697465249.0,What is the passing rate (slagingspercentages) of CBR for car in zoetermeer vs rijswijk?,post,reddit,https://www.reddit.com/r/Netherlands/comments/1796t5b/what_is_the_passing_rate_slagingspercentages_of/,0
16hsilm,1694624606.0,"I’m an 18 year old student and looking for jobs, any tips",post,reddit,https://www.reddit.com/r/Netherlands/comments/16hsilm/im_an_18_year_old_student_and_looking_for_jobs/,0
1405lwg,1685865550.0,Hair loss treatment specialist near Rijswijk,post,reddit,https://www.reddit.com/r/Netherlands/comments/1405lwg/hair_loss_treatment_specialist_near_rijswijk/,1
13cr0ou,1683641250.0,Cycling from Rijswijk to Delft - A Beautiful 4K Bike Ride Through the Ne...,post,reddit,https://youtube.com/watch?v=a3UcpM9LBLU&amp;feature=share,1
13cfk4a,1683607139.0,"Rijswijk, The Netherlands",post,reddit,https://i.redd.it/8bbiqcxe0sya1.jpg,296
113qw71,1676554898.0,Looking to rent apartments in and around Delft,post,reddit,https://www.reddit.com/r/Netherlands/comments/113qw71/looking_to_rent_apartments_in_and_around_delft/,0
zee9ec,1670351784.0,I arrived the Netherlands which one is for first registration and getting BSN?,post,reddit,https://www.reddit.com/r/Netherlands/comments/zee9ec/i_arrived_the_netherlands_which_one_is_for_first/,0
ys1fqa,1668142031.0,*Every Dutch city has (at least) one nickname: this is their list! (Sources cited below),post,reddit,https://www.reddit.com/r/Netherlands/comments/ys1fqa/every_dutch_city_has_at_least_one_nickname_this/,436
x5k9p8,1662289297.0,Olympic sized swimming pools for working professionals in the Hague area...,post,reddit,https://www.reddit.com/r/Netherlands/comments/x5k9p8/olympic_sized_swimming_pools_for_working/,0
vzj218,1657871808.0,Deregister Address in Rijswijk Online,post,reddit,https://www.reddit.com/r/Netherlands/comments/vzj218/deregister_address_in_rijswijk_online/,0
tgf4g2,1647537159.0,BSN Registration (which gemeente to use),post,reddit,https://www.reddit.com/r/Netherlands/comments/tgf4g2/bsn_registration_which_gemeente_to_use/,0
sgetys,1643565786.0,Dutch Railway (Rijswijk station),post,reddit,https://i.redd.it/0fj2l98e7ve81.jpg,128
dkv7yf,1571632125.0,Opinions on Zoetermeer and areas to avoid?,post,reddit,https://www.reddit.com/r/Netherlands/comments/dkv7yf/opinions_on_zoetermeer_and_areas_to_avoid/,18
arm6nz,1550421544.0,"I give up... where can I find good, cheap pita bread in The Hague?",post,reddit,https://www.reddit.com/r/Netherlands/comments/arm6nz/i_give_up_where_can_i_find_good_cheap_pita_bread/,1
17067h,1358795954.0,A public transport enquiry.,post,reddit,https://www.reddit.com/r/Netherlands/comments/17067h/a_public_transport_enquiry/,12
1l1hbbh,1748868960.0,Rijswijk: Insanely expensive appartment only 28m2,post,reddit,https://www.funda.nl/detail/huur/rijswijk-zh/appartement-leeuwendaallaan-15/43931606/,4
1gl8n3v,1730925939.0,"Rijswijk (its near Den Haag): Get over the US election blues with this 84sqm E label (2022) is retailing for 1540 offered by Woonzeker. Bust and stamp out a potential future donald trump (he started out as a landlord) in their infancy...reduced to 800 but beware, photos are missing from ad,",post,reddit,https://i.redd.it/h1xflicveczd1.png,14
1lf3o78,1750314095.0,Registering in Rijswijk Municipality,post,reddit,https://www.reddit.com/r/StudyInTheNetherlands/comments/1lf3o78/registering_in_rijswijk_municipality/,0
1cj4zmq,1714730844.0,Student Housing at Polakweg 15,post,reddit,https://www.reddit.com/r/StudyInTheNetherlands/comments/1cj4zmq/student_housing_at_polakweg_15/,1
1oohtgp,1762286896.0,Waar in Den Haag of Rijswijk koop ik luxe mosterd?,post,reddit,https://www.reddit.com/r/TheHague/comments/1oohtgp/waar_in_den_haag_of_rijswijk_koop_ik_luxe_mosterd/,8
1oobqld,1762273650.0,My experience passing the driver theory test,post,reddit,https://www.reddit.com/r/TheHague/comments/1oobqld/my_experience_passing_the_driver_theory_test/,27
1o3zymv,1760200035.0,Difference between Oud Rijswijk and Rijswijk?,post,reddit,https://www.reddit.com/r/TheHague/comments/1o3zymv/difference_between_oud_rijswijk_and_rijswijk/,0
1o3v3fr,1760187773.0,🏏 Looking for a cricket club for my 9-year-old in The Hague,post,reddit,https://www.reddit.com/r/TheHague/comments/1o3v3fr/looking_for_a_cricket_club_for_my_9yearold_in_the/,0
1nrpnbd,1758960483.0,Rijswijk Halloween,post,reddit,https://i.redd.it/n3zgae6l0orf1.jpeg,17
1nl1i5m,1758282911.0,Looking to make new connections,post,reddit,https://www.reddit.com/r/TheHague/comments/1nl1i5m/looking_to_make_new_connections/,8
1nicw5n,1758015450.0,digital cameras?,post,reddit,https://www.reddit.com/r/TheHague/comments/1nicw5n/digital_cameras/,1
1nfu0fb,1757758948.0,"Standwalfestival, Rijswijk Bos/Huis de Stad, right now.",post,reddit,https://www.reddit.com/gallery/1nfu0fb,24
1nd8wk8,1757494077.0,Hobby 2e hands verkoop,post,reddit,https://www.reddit.com/r/TheHague/comments/1nd8wk8/hobby_2e_hands_verkoop/,10
1n9b4e2,1757092483.0,Strandwalfestival Rijswijk - Sept.13 &amp; 14,post,reddit,https://strandwalfestival.nl/,1
1n25ln0,1756365418.0,Cycling routes in the Hague,post,reddit,https://i.redd.it/4mzqlrp4oplf1.jpeg,22
1mzn7bd,1756119058.0,English Boardgaming and RPG Meetup Group | Meetup,post,reddit,https://www.meetup.com/english-boardgaming-and-rpg-meetup-group/,10
1mwn4g3,1755810068.0,Other (big) markets than Haagse Markt for produce,post,reddit,https://www.reddit.com/r/TheHague/comments/1mwn4g3/other_big_markets_than_haagse_markt_for_produce/,5
1mpwa0x,1755165518.0,"Main Quest Con - Broodfariek, Rijswijk",post,reddit,https://www.mainquestcon.com/,10
1mhhl1e,1754323569.0,Ervaringen met De Horeca Academie?,post,reddit,https://www.reddit.com/r/TheHague/comments/1mhhl1e/ervaringen_met_de_horeca_academie/,5
1mggp3o,1754219669.0,Looking for pet-friendly rental around The Hague / Voorburg / Delft,post,reddit,https://www.reddit.com/r/TheHague/comments/1mggp3o/looking_for_petfriendly_rental_around_the_hague/,0
1mcizur,1753812866.0,Any basis school in rijswijk?,post,reddit,https://www.reddit.com/r/TheHague/comments/1mcizur/any_basis_school_in_rijswijk/,0
1m7xhnm,1753340471.0,"Biennial art event - Textile Biennale '25, Museum Rijswijk",post,reddit,https://museumrijswijk.nl/tentoonstellingen.php,2
1lvi3h8,1752065808.0,Visiting The Hague look here for hidden gems,post,reddit,https://www.reddit.com/r/TheHague/comments/1lvi3h8/visiting_the_hague_look_here_for_hidden_gems/,16
1leijch,1750256896.0,Finding good mangoes,post,reddit,https://www.reddit.com/r/TheHague/comments/1leijch/finding_good_mangoes/,5
1lann6b,1749840027.0,Thoughts on specific neighborhoods and other municipalities around The Hague?,post,reddit,https://www.reddit.com/r/TheHague/comments/1lann6b/thoughts_on_specific_neighborhoods_and_other/,2
1laly6n,1749835963.0,Oud Rijswijk,post,reddit,https://www.reddit.com/r/TheHague/comments/1laly6n/oud_rijswijk/,0
1kjxs5s,1746958649.0,Nieuwe mensen leren kennen in (de buurt van) Rijswijk / Den Haag,post,reddit,https://www.reddit.com/r/TheHague/comments/1kjxs5s/nieuwe_mensen_leren_kennen_in_de_buurt_van/,45
1jretb2,1743780864.0,Skyline The Hague,post,reddit,https://i.redd.it/rdj3wpjs7use1.jpeg,148
1jkj4fu,1743014337.0,"Creative meetup in Rijswijk, Saturday April 5th",post,reddit,https://www.reddit.com/r/TheHague/comments/1jkj4fu/creative_meetup_in_rijswijk_saturday_april_5th/,29
1ji0p1j,1742740652.0,Experiences with selling at a booth at Neuzelbeurs?,post,reddit,https://www.reddit.com/r/TheHague/comments/1ji0p1j/experiences_with_selling_at_a_booth_at_neuzelbeurs/,5
1ja63w3,1741848916.0,Trumpet Courses in Den Haag,post,reddit,https://www.reddit.com/r/TheHague/comments/1ja63w3/trumpet_courses_in_den_haag/,0
1j1ouyu,1740914984.0,Baby swimming lessons,post,reddit,https://www.reddit.com/r/TheHague/comments/1j1ouyu/baby_swimming_lessons/,1
1j03ld4,1740733677.0,Custom size glass panel fix?,post,reddit,https://www.reddit.com/r/TheHague/comments/1j03ld4/custom_size_glass_panel_fix/,4
1izksnc,1740676138.0,City-marketing voor Rijswijk in Utrecht?,post,reddit,https://i.redd.it/rpqlbugurple1.jpeg,19
1iikoll,1738789140.0,"Creative meetup in Rijswijk, Saturday Feb 8th",post,reddit,https://www.reddit.com/r/TheHague/comments/1iikoll/creative_meetup_in_rijswijk_saturday_feb_8th/,16
1ihovvz,1738694329.0,Ik ben op zoek naar een plek waar ze deze muziek draaien,post,reddit,https://www.reddit.com/r/TheHague/comments/1ihovvz/ik_ben_op_zoek_naar_een_plek_waar_ze_deze_muziek/,5
1hyv8aw,1736599886.0,"Creative meetup in Rijswijk, Saturday January 18th",post,reddit,https://www.reddit.com/r/TheHague/comments/1hyv8aw/creative_meetup_in_rijswijk_saturday_january_18th/,45
1huusz9,1736153675.0,Rijswijk English hobby/boardgame spot,post,reddit,https://www.reddit.com/r/TheHague/comments/1huusz9/rijswijk_english_hobbyboardgame_spot/,26
1hotdwf,1735468273.0,RTL overzicht van gevaarlijke plekken,post,reddit,https://i.redd.it/h8j9l9nklr9e1.jpeg,60
1gwn3pq,1732215258.0,Toddler carseat rental,post,reddit,https://www.reddit.com/r/TheHague/comments/1gwn3pq/toddler_carseat_rental/,4
1go6btm,1731260957.0,"Op zoek naar ervaringen van mensen die in Laak wonen, omgeving Sinjeur Semeynsweg!",post,reddit,https://www.reddit.com/r/TheHague/comments/1go6btm/op_zoek_naar_ervaringen_van_mensen_die_in_laak/,9
1g2mf84,1728814104.0,Co-working space (flex/desk),post,reddit,https://www.reddit.com/r/TheHague/comments/1g2mf84/coworking_space_flexdesk/,1
1fxg5o9,1728220271.0,Gezocht: Betrouwbare garage in Rijswijk,post,reddit,https://www.reddit.com/r/TheHague/comments/1fxg5o9/gezocht_betrouwbare_garage_in_rijswijk/,5
1frb2e1,1727518040.0,Gym with sauna,post,reddit,https://www.reddit.com/r/TheHague/comments/1frb2e1/gym_with_sauna/,7
1f45z6s,1724946983.0,Centrum Garbage Disposal,post,reddit,https://www.reddit.com/r/TheHague/comments/1f45z6s/centrum_garbage_disposal/,0
1eksy5w,1722877108.0,English speaking job,post,reddit,https://www.reddit.com/r/TheHague/comments/1eksy5w/english_speaking_job/,0
1edfv3a,1722085296.0,"Is Voorburg, Leidschendam, Rijswijk and other similar towns round Den Haag are actually considered to be different cities?",post,reddit,https://www.reddit.com/r/TheHague/comments/1edfv3a/is_voorburg_leidschendam_rijswijk_and_other/,17
1dvj8nn,1720132574.0,Any cat groomers in the Hague?,post,reddit,https://www.reddit.com/r/TheHague/comments/1dvj8nn/any_cat_groomers_in_the_hague/,3
1dtlfnh,1719925723.0,Where to find rules that a dormer window (dakkapel) needs a permit in Rijswijk,post,reddit,https://www.reddit.com/r/TheHague/comments/1dtlfnh/where_to_find_rules_that_a_dormer_window_dakkapel/,3
1dn6lpv,1719209290.0,Padel/golf players,post,reddit,https://www.reddit.com/r/TheHague/comments/1dn6lpv/padelgolf_players/,1
1diov0s,1718711817.0,Eating out near Rijswijk,post,reddit,https://www.reddit.com/r/TheHague/comments/1diov0s/eating_out_near_rijswijk/,11
1d56i4u,1717190344.0,The Hague vs Groningen,post,reddit,https://www.reddit.com/r/TheHague/comments/1d56i4u/the_hague_vs_groningen/,1
1c9rt4n,1713731279.0,Looking for a pizza place that serves crispy pizzas.,post,reddit,https://www.reddit.com/r/TheHague/comments/1c9rt4n/looking_for_a_pizza_place_that_serves_crispy/,7
1c41d9k,1713121707.0,Werkruimtes/Panden in Rijswijk,post,reddit,https://www.reddit.com/r/TheHague/comments/1c41d9k/werkruimtespanden_in_rijswijk/,0
1b8du3o,1709765330.0,Central Station closed on the weekend,post,reddit,https://www.reddit.com/r/TheHague/comments/1b8du3o/central_station_closed_on_the_weekend/,3
1ad37h2,1706450250.0,Zijn er ergens nog oliebollen te koop?,post,reddit,https://www.reddit.com/r/TheHague/comments/1ad37h2/zijn_er_ergens_nog_oliebollen_te_koop/,9
18uek86,1703939121.0,Experiences living in Wateringen?,post,reddit,https://www.reddit.com/r/TheHague/comments/18uek86/experiences_living_in_wateringen/,2
16zkbw8,1696417877.0,Rijschool,post,reddit,https://www.reddit.com/r/TheHague/comments/16zkbw8/rijschool/,5
16je47e,1694786203.0,Futsal / zaalvoetbal in The Hague: looking for extra players!,post,reddit,https://www.reddit.com/r/TheHague/comments/16je47e/futsal_zaalvoetbal_in_the_hague_looking_for_extra/,5
14jmpzs,1687798672.0,Best sushi place in Den Haag?,post,reddit,https://i.redd.it/3zo5hp4z7e8b1.jpg,2
14gzxsz,1687530280.0,"Monkeytown on a hot day, doable?",post,reddit,https://www.reddit.com/r/TheHague/comments/14gzxsz/monkeytown_on_a_hot_day_doable/,0
142sth2,1686084554.0,"Start work Sept 1, when should we start looking for an apartment?",post,reddit,https://www.reddit.com/r/TheHague/comments/142sth2/start_work_sept_1_when_should_we_start_looking/,0
13wvjz4,1685561366.0,Help me mod this subreddit!,post,reddit,https://www.reddit.com/r/TheHague/comments/13wvjz4/help_me_mod_this_subreddit/,31
13ebjay,1683774770.0,Cycling from Rijswijk to Delft - A Beautiful 4K Bike Ride Through the Ne...,post,reddit,https://youtube.com/watch?v=a3UcpM9LBLU&amp;feature=share,7
13aq1u3,1683469846.0,Is this a safe neighborhood for a student to live in? Thanks :),post,reddit,https://i.redd.it/in9bq2b6ogya1.jpg,13
130y484,1682616277.0,"Wilhelmina park, Rijswijk",post,reddit,https://www.reddit.com/gallery/130y484,66
12fi56s,1680950431.0,"Exploring the Wealthiest Neighborhoods in The Hague: Voorburg, Rijswijk ...",post,reddit,https://youtube.com/watch?v=UYhEkRlZru8&amp;feature=share,0
124rtlo,1680016309.0,"Moerwijk, Rijswijk in The Hague and Voorburg, The Netherlands",post,reddit,https://youtube.com/watch?v=HtuQeFLUZPk&amp;feature=share,7
11xoyyg,1679421899.0,"Getting from Delft/Rijswijk direction Scheveningen/Duindorp these days is nerve-wracking. 10km, took me today 1,5h. Constructions. Constructions and traffic jam everywhere. Avoid going by car if you can...",post,reddit,https://i.imgur.com/rmibXas.jpg,85
112dnwi,1676402415.0,Fietsenmaker Den Haag / Rijswijk,post,reddit,https://www.reddit.com/r/TheHague/comments/112dnwi/fietsenmaker_den_haag_rijswijk/,5
xi685b,1663576719.0,Etymology/Origin of the name Rijswijk?,post,reddit,https://www.reddit.com/r/TheHague/comments/xi685b/etymologyorigin_of_the_name_rijswijk/,3
wu27jl,1661095502.0,Gym and personal trainer,post,reddit,https://www.reddit.com/r/TheHague/comments/wu27jl/gym_and_personal_trainer/,2
v9tsjh,1654938924.0,Dog parks near Laak/HS,post,reddit,https://www.reddit.com/r/TheHague/comments/v9tsjh/dog_parks_near_laakhs/,1
tbs1js,1647011045.0,Futsal / zaalvoetbal in The Hague: looking for players!,post,reddit,https://www.reddit.com/r/TheHague/comments/tbs1js/futsal_zaalvoetbal_in_the_hague_looking_for/,24
prt0q8,1632137805.0,Free dinner in Museum Rijswijk! (Dutch speaking),post,reddit,https://www.reddit.com/r/TheHague/comments/prt0q8/free_dinner_in_museum_rijswijk_dutch_speaking/,26
ko1792,1609459837.0,VIDEO: Meerdere mensen in brand bij ontploffing in Rijswijk,post,reddit,https://www.omroepwest.nl/nieuws/4188761/VIDEO-Meerdere-mensen-in-brand-bij-ontploffing-in-Rijswijk,26
i6ih6z,1596975858.0,Wat te doen met oude potgrond?,post,reddit,https://www.reddit.com/r/TheHague/comments/i6ih6z/wat_te_doen_met_oude_potgrond/,7
hbbqwc,1592474340.0,Looking for an apartment to rent near Rijswijk,post,reddit,https://www.reddit.com/r/TheHague/comments/hbbqwc/looking_for_an_apartment_to_rent_near_rijswijk/,6
gcri3e,1588516130.0,Ondersteun uw lokale helden / Support your local heroes,post,reddit,https://www.reddit.com/r/TheHague/comments/gcri3e/ondersteun_uw_lokale_helden_support_your_local/,22
fece8w,1583495516.0,Rijswijk Centre for Sustainable Geo-energy geopend,post,reddit,https://www.energienieuws.info/2020/03/rijswijk-centre-for-sustainable-geo.html,12
dvqbdb,1573643661.0,Rijswijk hoeft er geen nieuwe sociale huurwoningen bij: ‘Lage inkomens zijn niet meer welkom’,post,reddit,https://www.ad.nl/den-haag/rijswijk-hoeft-er-geen-nieuwe-sociale-huurwoningen-bij-lage-inkomens-zijn-niet-meer-welkom~a8adf601/,7
cdv6u4,1563272524.0,"Grote brand in kantoorpand in Rijswijk, 'sluit ramen en deuren'",post,reddit,https://www.omroepwest.nl/nieuws/3865142/Grote-brand-in-kantoorpand-in-Rijswijk-sluit-ramen-en-deuren,8
azgdpc,1552229601.0,parking around the hague,post,reddit,https://www.reddit.com/r/TheHague/comments/azgdpc/parking_around_the_hague/,3
a2xjzg,1543900660.0,Nieuw innovatiecentrum aardwarmte op Kessler Park Rijswijk,post,reddit,http://www.energienieuws.info/2018/12/nieuw-innovatiecentrum-aardwarmte-op.html,5
9uyoyd,1541590768.0,Wie scheidt er GFT afval? | Who Composts?,post,reddit,https://www.reddit.com/r/TheHague/comments/9uyoyd/wie_scheidt_er_gft_afval_who_composts/,5
1n1ff5t,1756297034.0,Bijna 70.000 aanmeldingen voor massaclaim na hack bij bevolkingsonderzoek,post,reddit,https://nos.nl/l/2580080,143
1kd3c91,1746198576.0,Cemil Önal – gisteren vermoord in Rijswijk – waarschuwde de autoriteiten dat hij voor zijn leven vreesde,post,reddit,https://www.ftm.nl/artikelen/liquidatie-cemil-onal,159
1i18ae5,1736867800.0,Looking for a covered hall,post,reddit,https://www.reddit.com/r/thenetherlands/comments/1i18ae5/looking_for_a_covered_hall/,0
1hqghrk,1735657509.0,Zwerfafval opruimen &amp; afvaltarieven,post,reddit,https://www.reddit.com/r/thenetherlands/comments/1hqghrk/zwerfafval_opruimen_afvaltarieven/,70
1hhak11,1734552769.0,"Onderzoek naar nieuwe stations Rijswijk Buiten, Schiedam Kethel, Rotterdam van Nelle en Dordrecht Leerpark, extra sporen tussen Delft en Schiedam",post,reddit,https://www.treinreiziger.nl/nieuwe-stations-en-extra-sporen-tussen-leiden-en-dordrecht/,51
vwiogp,1657546750.0,Slang nicknames for every(?) Dutch city - list,post,reddit,https://www.reddit.com/r/thenetherlands/comments/vwiogp/slang_nicknames_for_every_dutch_city_list/,0
o4saqk,1624272145.0,Gemeente Rijswijk bouwt zelf huurwoningen in middensegment,post,reddit,https://www.nu.nl/economie/6140764/gemeente-rijswijk-bouwt-zelf-huurwoningen-in-middensegment.html,58
jjbigb,1603837712.0,Blikseminslag doet boom ontploffen in Rijswijk. Splinter boort zich in muur.,post,reddit,https://i.redd.it/qgwavokfrpv51.jpg,125
bfc62s,1555766833.0,Uitbreiding van flair-vlaggetjes voor abonnees -- Expansion of flair flags for subscribers,post,reddit,https://www.reddit.com/r/thenetherlands/comments/bfc62s/uitbreiding_van_flairvlaggetjes_voor_abonnees/,34
an0mml,1549278142.0,College Rijswijk valt om energieplannen,post,reddit,https://www.telegraaf.nl/nieuws/3106269/college-rijswijk-valt-om-energieplannen,9
93nku2,1533116912.0,Subreddit Statistics voor /r/theNetherlands van juli.,post,reddit,https://www.reddit.com/r/thenetherlands/comments/93nku2/subreddit_statistics_voor_rthenetherlands_van_juli/,28
8vhpk8,1530528738.0,Vier docenten ontslagen na examenfraude Rijswijks Lyceum,post,reddit,https://nos.nl/artikel/2239478-vier-docenten-ontslagen-na-examenfraude-rijswijks-lyceum.html,155
6b9nhx,1494845220.0,'Gruwelijke experimenten op apen in testcentrum Rijswijk',post,reddit,https://www.rtlnieuws.nl/nederland/gruwelijke-experimenten-op-apen-in-testcentrum-rijswijk,1
5p3tl1,1484918353.0,Octrooibureau in Rijswijk blijft onschendbaar,post,reddit,https://www.nrc.nl/nieuws/2017/01/19/hoge-raad-buigt-zich-over-battistellis-juridische-eiland-6286236-a1542142,19
5oi2e7,1484659935.0,Disc golf in the Netherlands?,post,reddit,https://www.reddit.com/r/thenetherlands/comments/5oi2e7/disc_golf_in_the_netherlands/,5
5f4nlh,1480240687.0,"Ik hou van fietsen in Nederland! Super toff weer gisteren, wie anders heeft lekker gefietst?",post,reddit,https://i.redd.it/ql87o1arx40y.jpg,202
58pi80,1477082509.0,Massive expansion of user flairs! -- Enorme uitbreiding van onze flairs voor abonnees!,post,reddit,https://www.reddit.com/r/thenetherlands/comments/58pi80/massive_expansion_of_user_flairs_enorme/,39
4lko0q,1464533132.0,"Ledenenquête Rover: Rotterdam CS, Delft en Valkenburg meest gastvrije treinstations van Nederland, Rijswijk meest onaangenaam",post,reddit,https://www.reddit.com/r/thenetherlands/comments/4lko0q/ledenenquête_rover_rotterdam_cs_delft_en/,17
4bwj2d,1458913905.0,V&amp;D Rijswijk dicht na vechtpartij,post,reddit,http://www.omroepwest.nl/nieuws/3112606/V-D-Rijswijk-dicht-na-vechtpartij,83
34q040,1430665456.0,Doekje (later) inlijsten?,post,reddit,https://www.reddit.com/r/thenetherlands/comments/34q040/doekje_later_inlijsten/,7
284ryq,1402756241.0,WK2014: asielhonden vs. asielkatten! Rijswijks asiel zet langzitters extra in de aandacht om baasjes aan te trekken,post,reddit,https://www.youtube.com/watch?v=CK6WHWQZ2m4,7
1ih0whs,1738626346.0,"If I wanted to keep a hidden gem to myself, and keep tourists away from it at all costs, I would do exactly the same. Just saying.",comment,reddit,,156
1ih0whs,1738653235.0,Probably a data processing error by the researchers,comment,reddit,,38
1ih0whs,1738658901.0,I hear Van Gogh wasn't appreciated much during his lifetime,comment,reddit,,37
1ih0whs,1738655526.0,It's just a very respectable top 380 this year.,comment,reddit,,28
1ih0whs,1738625356.0,Fake news.,comment,reddit,,77
1ih0whs,1738633864.0,Must not have considered the vending machine in the rating,comment,reddit,,42
1ih0whs,1738654623.0,Visionary things are often misunderstood. Give it some time.,comment,reddit,,23
1ih0whs,1738656114.0,We don't want this to become a lame Insta-selfie spot. Low profile,comment,reddit,,16
1ih0whs,1738654210.0,"How people find that ugly modern mess at Klimmen-Ransdaal (the top rated station) better I cant explain, people are just weird .....  [https://martijnvanvulpen.nl/wp-content/uploads/2012/08/20240120-006-Groot.jpg](https://martijnvanvulpen.nl/wp-content/uploads/2012/08/20240120-006-Groot.jpg)",comment,reddit,,11
1ih0whs,1738656768.0,This is Lelylaan slander and I will not stand for it.,comment,reddit,,9
1ih0whs,1738650338.0,All Feyenoord supporters.,comment,reddit,,12
1ih0whs,1738749706.0,You guys simply jealous of my station! The brutalism reminds me of my home - Bulgaria!,comment,reddit,,6
1ih0whs,1738654581.0,[deleted],comment,reddit,,3
1ih0whs,1738663859.0,Didn’t expect den helder zuid to be so high up.,comment,reddit,,2
1ih0whs,1738695074.0,Lage Zwaluwe is echt een ramp. Het staat gewoon ergens midden in een winderige polder. Wie dat ooit heeft bedacht...,comment,reddit,,2
1ih0whs,1738700354.0,Bij het lezen liet ik een kleine Lelytraan. :'(,comment,reddit,,2
1ih0whs,1738650549.0,This is real shit. I'll find these people! &gt;:(,comment,reddit,,2
1ih0whs,1738660157.0,what the fuck???,comment,reddit,,1
1ih0whs,1738666256.0,Live.,comment,reddit,,1
1ih0whs,1738687621.0,Quality&gt;Quantity!,comment,reddit,,1
1ih0whs,1738691842.0,"you should get more airbnbs so they get cheaper, they are way to expensive",comment,reddit,,1
1ih0whs,1738800049.0,make it make sense. statistics must be incorrect.,comment,reddit,,1
