post_id,created_at,content,content_type,source,url,score
113qw71,1676555669.0,"Use the search button. This question has already been asked a few hours ago, multiple times a day, every day, for months and years now.  There's a housing crisis. Shortage of housing even for people already living in the Netherlands.",comment,reddit,,15
113qw71,1676555404.0,"I really hope you mean March 2024, because March 2023 (that's in two weeks) would be a bit tight to find something decent.  You could try Rots Vast or Oude Delft (expat makelaar) if they're not also on Funda.",comment,reddit,,11
113qw71,1676560718.0,"You've been trying with no luck, meaning what? That you haven't found something that fits your requirements or that you got no responses?  Either way, you're kinda late wanting to rent something starting in two weeks. Hopefully you'll be making enough money to afford staying in a hotel for a while. But generally, if you'll be making good enough money it won't be much of a problem finding something eventually.  EDIT: Maybe also check StayAt7 in Rijswijk or the student hotel as an alternative to normal hotels for short-medium stay until you find something.",comment,reddit,,6
113qw71,1676556700.0,"I'd like to be supportive, but you're better off trying to find a job somewhere else than housing in Delft, in such a short timeframe.",comment,reddit,,6
113qw71,1676561165.0,"I would honestly suggest hiring a real estate agent. Have a look at the agencies that post ads on Funda and Pararius and contact them (check their websites for emails or contact forms), telling them your requirements, your situation, your salary, what work you'll be doing etc. etc. It will probably be quite costly (approx. 1 month's rent if I'm not mistaken), but it will potentially save you a considerable amount of time, as you only have a couple of weeks to find something. Trust me, it's not nice working on a new job and trying to find a house at the same time, and when you do find a house, having to move and arrange everything while working (been there, done that).  Are you in the Netherlands or abroad at the moment? I believe it will be easier for you to attend viewings if you are in NL, as the agents might not be willing to bother with online viewings.   Other suggestions:   [Rentslam](https://rentslam.com/en/). Paid service that sends housing ads (not just from Funda and Pararius) to your email very shortly after they have been posted. This is useful because the agencies get tens or even hundreds of responses for each ad, so they have enough people to choose who to invite for viewings very quickly. You need to be fast and be one of the first few people to apply for the house if you want to have a chance at being invited for a viewing.   Write a nice text to send to the agencies. Consider this like a cover letter for a job. Sell yourself to the potential landlord of each house and give them all the information they might need. Don't make it too long.   Have realistic expectations. You will not find a decent one bedroom apartment for less than 1000euro/month (not including bills). Consider housesharing if your situation allows it, even if it's only to get started.   Expand your area. Look at other towns/cities/villages that might be a bit farther, but if they're not main hubs (like the Hague, Delft itself and Rotterdam) there might be less competition. Check Google Maps, the NS website and 9292 to see if there are good public transport connections to Delft from these places.   Good luck!",comment,reddit,,5
113qw71,1676556475.0,Is this a troll post?,comment,reddit,,6
113qw71,1676560190.0,[deleted],comment,reddit,,1
zee9ec,1670355732.0,"Call the municipality, not ask on Reddit.",comment,reddit,,6
zee9ec,1670357776.0,"The municipality’s website states that you will receive a BSN after registering as a resident, have you done that yet? If not, you should choose “Verhuizen naar of binnen Rijswijk”",comment,reddit,,3
zee9ec,1670352358.0,frame subtract profit retire plant silky rain vegetable gaze oatmeal   *This post was mass deleted and anonymized with [Redact](https://redact.dev/home)*,comment,reddit,,3
zee9ec,1670417939.0,"When you are coming from abroad, you always have to do this in person. With most municipalities it is not possible to make an appointment online. Please call the municipality of Rijswijk to make an appointment. They will also discuss with you what kind of documents you have to bring with you.   I work at a municipality at the department of civil affairs and as far as i know you always have to call if you want to report your move from abroad. After registration you will receive your BSN within 10 days by post.",comment,reddit,,1
ys1fqa,1668144960.0,Amersfoort: Keistad is in the wiki but not on your list.,comment,reddit,,109
ys1fqa,1668146656.0,"Ik kom origineel uit Haarlem, maar die bijnamen nog nooit gehoord..",comment,reddit,,97
ys1fqa,1668153064.0,[removed],comment,reddit,,90
ys1fqa,1668151596.0,Ik heb werkelijk waar nog nooit gehoord van 'Dubbel A' voor Aalsmeer. En ik woon hier toch al mijn hele leven.,comment,reddit,,32
ys1fqa,1668152983.0,De domstad?? Serieus?? Hahaha sorry hoor maar dat is de enige echte bijnaam van utrecht,comment,reddit,,26
ys1fqa,1668155308.0,"Utereg, utreg, UUUUUU, Domstad, me stadschie, 030, Nul deteg, het Sticht, Trajectum... Maybe more, but that's how far I've come on the toilet",comment,reddit,,29
ys1fqa,1668149268.0,Stadskanaal als Stakka??? Niemand hier noemt het dat behalve de gemeentelijke media.  Het is: Knoal  Kanaal in het Gronings,comment,reddit,,34
ys1fqa,1668164552.0,Dit lijstje klinkt alsof deze bedacht is door 12-jarigen op het schoolplein die net hebben ontdekt dat straattaal bestaat.,comment,reddit,,46
ys1fqa,1668144081.0,Maastricht: maasi is more common than maas,comment,reddit,,55
ys1fqa,1668150959.0,"Can confirm. Tilly, Tillywood en Chillburg worden weleens in de mond genomen.",comment,reddit,,12
ys1fqa,1668155812.0,Amsterdam as Abcoude Noord got me good,comment,reddit,,13
ys1fqa,1668147228.0,Waalwijk: Wolluk  I've never heard of those names for Breda. I do know of the names Parel van het Zuiden or Suck City.,comment,reddit,,25
ys1fqa,1668148062.0,Is this list made by some 12 year olds?,comment,reddit,,72
ys1fqa,1668148356.0,Brooklyn voor Breukelen!,comment,reddit,,11
ys1fqa,1668148338.0,Drachten wordt ook wel de Almere van Friesland genoemd,comment,reddit,,11
ys1fqa,1668148447.0,Best - Eindhoven buiten,comment,reddit,,10
ys1fqa,1668150269.0,For Leiden you can add Sleutelstad,comment,reddit,,11
ys1fqa,1668146291.0,"Woon al m’n hele leven in Alphen, nog nooit gehoord van Al-Fun… wij zeiden wel eens Alphen aan de Rhino 🦏",comment,reddit,,20
ys1fqa,1668144128.0,Best: Klompengat (during carnaval at least),comment,reddit,,8
ys1fqa,1668155627.0,_Abcoude Noord_  Excuse me what 🤣,comment,reddit,,6
ys1fqa,1668155983.0,"Wat betreft lijstje Leeuwarden, nog nooit van gehoord.  Ljouwert in het Fries en Liwwarden in het Leeuwarders. Meer niet.",comment,reddit,,5
ys1fqa,1668154078.0,"Middelburg is not called The Burg, and it's definitely not called Middy or Midje. I've Googled your ""sources"" and found one half-Indian Facebook page referencing Middelburg a ""Midje"" and Vlissingen as ""Vliss"", but you then decide to use the one for Middelburg and not Vlissingen. Weird.  The one calling Middelburg ""Middy"" is a single written blogpost of someone moving from Middelburg to Amsterdam because they couldn't continue their study trajectory here. They also happen to be a Roosevelt student, an English-centered college for international students so the likelihood of this being culturally or socially established is dubious at best since they're not known for being the most socially intergrated group of students.  To offer a consolation price, the one nickname I **have** heard for Middelburg is ""MBG"" or like many cities in the Netherlands, it being referred to by their area code which is 0118 (nul-elf-acht). However, referring to cities by their area code is something popular everywhere, so it's not a unique instance or nickname.",comment,reddit,,17
ys1fqa,1668148160.0,Vlaardingen is 100% geen Vlada maar Vlaffa 🤣,comment,reddit,,5
ys1fqa,1668157219.0,In Groningen zeggen we nooit Groningen maar vaak gewoon 'Stad'  Waar kom je weg? Ik kom uit Stad.![gif](emote|free_emotes_pack|feels_good_man),comment,reddit,,5
ys1fqa,1668151026.0,The majority sounds like made up.,comment,reddit,,18
ys1fqa,1668144440.0,Oldenzaal: Boeskoolstad en Olnzel,comment,reddit,,4
ys1fqa,1668145201.0,[deleted],comment,reddit,,5
ys1fqa,1668145327.0,"Deventer's Dimma is far more common that Diffa, and it's not on the list",comment,reddit,,4
ys1fqa,1668150354.0,"Lol, I see several Mokum's, that can't be right ...",comment,reddit,,5
ys1fqa,1668155150.0,I’m from Hoorn and here to tell you that no one calls it that,comment,reddit,,4
ys1fqa,1668144929.0,Mijn ouders gebruiken voor Hendrik-ido-ambacht altijd kiellekielle ambacht.,comment,reddit,,4
ys1fqa,1668147658.0,beverwoekoeee,comment,reddit,,4
ys1fqa,1668148464.0,Winterswijk: Wenters,comment,reddit,,5
ys1fqa,1668155179.0,"Geertruidenberg wordt vaak verkort naar D'nBerg (zonder spatie omdat het als 1 woord wordt uitgesproken)  Verder vind ik het een dubieuze lijst, teveel bijnamen die mensen echt niet kennen. En carnavalsnamen horen er niet op, daar zal vast een andere lijst van bestaan.",comment,reddit,,3
ys1fqa,1668155779.0,Delft: most common is Delluf and that's not on the list,comment,reddit,,4
ys1fqa,1668156601.0,"Niemand zegt Doeti, iedereen zegt eerder Dtc",comment,reddit,,3
ys1fqa,1668172705.0,Wat heb jij gerookt? Wat een onzinnamen.,comment,reddit,,3
ys1fqa,1668152475.0,Wat een bagger lijst. Ik kan het volk dat dit zegt al ruiken voor ze de hoek omkomen lopen.,comment,reddit,,15
ys1fqa,1668148334.0,Hogga,comment,reddit,,3
ys1fqa,1668149773.0,"Bergen op zoom, krabbengat",comment,reddit,,3
ys1fqa,1668155351.0,Alphen aan de Rijn --&gt; Afval aan de Rijn,comment,reddit,,3
ys1fqa,1668156081.0,"Some additions: Nijmegen can also be Nimwegen and a nickname of Waalwijk is Wolluk. They even cringely have flags with ""you never Wolluk alone"" in the foorball stadium of Rkc. Oh and not official but me and my friends call geldrop droppie",comment,reddit,,3
ys1fqa,1668156361.0,Hofstad voor Den Haag,comment,reddit,,3
ys1fqa,1668156598.0,Amsterdam == Adam,comment,reddit,,3
ys1fqa,1668156618.0,"I lived my entire life next to Bergen op Zoom and never heard of those names. We use BoZ for short writing but never say : I'm going to BoZ 🥴 We say ""Berrege"" or ""Krabbegat"" with Carnaval.   I think the list is not correct, a bit dumb in fact.",comment,reddit,,3
ys1fqa,1668156689.0,Enkhuizen als Enky of Enkycity staat er niet eens in…,comment,reddit,,3
ys1fqa,1668159875.0,Bergen op Zoom is Krabbegat (very important during Carnaval). Except for BoZ nobody uses those other names.  Steenbergen: Strienestad  Roosendaal: Tullepetaonestad  https://nl.m.wikipedia.org/wiki/Lijst_van_alternatieve_Nederlandse_plaatsnamen_tijdens_carnaval,comment,reddit,,3
ys1fqa,1668160032.0,"Haal alsjeblieft G-Town weg bij Gouda, niemand noemt het zo. Kaasstad mag uiteraard wel blijven",comment,reddit,,3
ys1fqa,1668161615.0,Heb echt nog nooit van Ziffa gehoord voor Zevenaar 😂,comment,reddit,,3
ys1fqa,1668162366.0,Noord Abcoude as a nickname for Amsterdam is really funny to me for some reason,comment,reddit,,3
ys1fqa,1668164479.0,"Zwollywood is bekend, maar ik heb het idee dat het minder gebruikt worden dan eerder.  Opgezwolle is een muziekgroep, geen bijnaam voor de stad.",comment,reddit,,3
ys1fqa,1668170524.0,This whole list reads like some American had to make up new names for all our cities....,comment,reddit,,3
ys1fqa,1668176424.0,"Weet niet waar je dit vandaan hebt, maar deze namen zijn echt heel dom",comment,reddit,,3
ys1fqa,1668177100.0,Een lijst die echt nergens op slaat.,comment,reddit,,3
ys1fqa,1668180012.0,"&gt;Alphen aan den Rijn	Alpino aan de Rino, Al-Fun  &amp;#x200B;  Wat? Ik woon al mijn hele leven in Alphen en ik heb niemand dit ooit horen zeggen.",comment,reddit,,3
ys1fqa,1668180236.0,"Dit lijstje is zo erg slecht.  Zelfs plaatsen die een ""?"" hebben staan maar in het echt wel een bij naam hebben.",comment,reddit,,3
ys1fqa,1668182645.0,"Duiven = Dat dorp met de IKEA.  Not a joke, when I tell people where I'm from, that's the first thing they say. That or ""what?""",comment,reddit,,3
ys1fqa,1668184846.0,"Opgegroeid in zuffa, verhuist naar agga. Can confirm",comment,reddit,,3
ys1fqa,1668146671.0,"I got one extra for you, Barneveld also has B'veld. We call it toktokcity ourselfs to, so that's correct. Nice list!",comment,reddit,,5
ys1fqa,1668147502.0,Schiedam &gt; Schiebiza,comment,reddit,,2
ys1fqa,1668149564.0,Nieuw vennep - nieuw hennep,comment,reddit,,2
ys1fqa,1668152846.0,Fijn dat Papendrecht erop staat als stad !,comment,reddit,,2
ys1fqa,1668152919.0,Veenendaal: t' Veen,comment,reddit,,2
ys1fqa,1668153013.0,Oud Beijerland / OBL,comment,reddit,,2
ys1fqa,1668153472.0,"Steina, Geina, U, Utje, Almerde kloppen allemaal wel, ja. Steina en Geina gebruikte ik alleen toen ik nog in mijn tienerjaren was, en nu soms nog ironisch. Almerde voornamelijk van mijn ouders gehoord en Utje en U worden nog steeds gebruikt. Wel mis ik Vianen in deze lijst! Is ook een stad.",comment,reddit,,2
ys1fqa,1668153742.0,"Noordwijk is het enige dat me te binnen schiet Noortuk, gevolgd door 'zee' of 'binnen' als we specifieker moeten zijn.",comment,reddit,,2
ys1fqa,1668154357.0,Loon op zand = loon of loonpzaand Waalwijk = Wollik,comment,reddit,,2
ys1fqa,1668154525.0,Ik heb nog nooit van hang low of almeloco gehoord. Waar heb je dit vandaan?,comment,reddit,,2
ys1fqa,1668154625.0,"Gorkije, ik dacht oprecht dat alleen wij dat zo noemden. Wat een prachtbijnaam.",comment,reddit,,2
ys1fqa,1668155548.0,Ik zie er ook gemeentes in staan ipv dorpen..,comment,reddit,,2
ys1fqa,1668156182.0,Breda - Parel van 't zuiden :),comment,reddit,,2
ys1fqa,1668156271.0,Doetinchem: DTC,comment,reddit,,2
ys1fqa,1668156515.0,"Ben geboren en getogen in Zevenaar (woon er sinds 2017 niet meer), maar ik heb nog nooit van Ziffa gehoord 👀",comment,reddit,,2
ys1fqa,1668156712.0,It’s Waga not Wagga for Wageningen. Pronounced Waagaa. At least that’s how I’ve always known it. I did hear Waggie before but Waga is way more common I think.,comment,reddit,,2
ys1fqa,1668157507.0,Kattuk for Katwijk!,comment,reddit,,2
ys1fqa,1668158164.0,"Nijkerk heeft niet echt een bijnaam, maar ik heb er 18 jaar ofzo gewoond en echte nijkerkers zeggen altijd Niekark op het dialect.",comment,reddit,,2
ys1fqa,1668158572.0,Amersfoort -&gt; Anuspoort,comment,reddit,,2
ys1fqa,1668159729.0,Schijndel: Placebo-Prostituee,comment,reddit,,2
ys1fqa,1668159777.0,"Ik heb er een gemist....  Schoonhoven, de zilverstad",comment,reddit,,2
ys1fqa,1668162061.0,Niemand praat zo.  Zwijndrecht = Zweinstein,comment,reddit,,2
ys1fqa,1668162889.0,Ik mis Heerlen: Junky town,comment,reddit,,2
ys1fqa,1668163186.0,Leiden also sometimes called Sleutelstad? Although it might be a motto instead,comment,reddit,,2
ys1fqa,1668168583.0,Hilversum = Hilly,comment,reddit,,2
ys1fqa,1668168721.0,Deventer wordt ook wel ‘Moskou aan de IJssel’ genoemd. Wat ik aardig toepasselijk vind ook.  En ook demtah of deemta Of iets in die verbastering. Dtown echt nooit nooit van gehoord.,comment,reddit,,2
ys1fqa,1668170709.0,Als oud-inwoner van Sneek moet ik ontkennen dat iemand die stad zo noemt.,comment,reddit,,2
ys1fqa,1668171321.0,"""Every city"" they say as they proceeds to show a list missing a bunch of cities which instead also has a bunch of towns in there.",comment,reddit,,2
ys1fqa,1668171423.0,Baarn = Het Groene Graf,comment,reddit,,2
ys1fqa,1668174563.0,Barneveld - Kiependarp,comment,reddit,,2
ys1fqa,1668175815.0,"Schiedam: Jeneverstad, Zwart Nazareth, Brandersgat",comment,reddit,,2
ys1fqa,1668179022.0,"Utrecht: Utreg, Utereg.",comment,reddit,,2
ys1fqa,1668179397.0,"Ik noem Amsterdam altijd A'dam, Deventer altijd Demtah, en Utrecht altijd Utreg",comment,reddit,,2
ys1fqa,1668181277.0,Is een Stone Coal English vertaling van een plaatsnaam ook al een nickname?,comment,reddit,,2
ys1fqa,1668182207.0,Haha wel top dit hoor,comment,reddit,,2
ys1fqa,1668183949.0,Nijkerk wordt ook wel eens Niekark genoemd,comment,reddit,,2
ys1fqa,1668186492.0,Sinds wanneer wordt Amsterdam ‘Masterdam’ en de andere rare namen genoemd ? 💀  Damsko en Mokum zijn zover ik weet de bijnamen,comment,reddit,,2
ys1fqa,1668196047.0,"As proud owner of r/Raalte I can say you these 2, Ralla and Raaltown",comment,reddit,,2
ys1fqa,1668208326.0,You made the mistake of using slang (straataal). These are only said my a very specific group of people. My additions are Katwijk aan Zee: Kattuk Noordwijk (Noordwijk Binnen is only a part of Noordwijk): Noortuk Leiden: Sleutelstad (remove the rest) Zandvoort: Zandje,comment,reddit,,2
ys1fqa,1668209613.0,"I lived in Utrecht from 1990-2012 and never heard of Utca, Uutje, etcetera.  And you're missing all the obvious well known ones:  Deventer - Koekstad, Moskou aan de IJssel, Demta (but okay, that last one is just bad spelling for the local dialect)  Amersfoort - Keistad  Nijmegen - Keizerstad",comment,reddit,,2
ys1fqa,1668213480.0,Some real gatekeeping going on in this comment section,comment,reddit,,2
ys1fqa,1668217876.0,i live in Emmen and NO ONE here calls it MM. and yes i am born in Emmen. so i dont know who came up with this. but we sure as hell didnt.,comment,reddit,,2
ys1fqa,1668142988.0,Velserbroek: velserbronx en pampercity.,comment,reddit,,6
ys1fqa,1668148938.0,Beverwijk schrijf ik altijd als Biffa en niet als Bivva.,comment,reddit,,2
ys1fqa,1668174527.0,"""EvErY cItY hAs A nIcKnAmE"" *helft niet ingevuld of straight up verzonnen.*",comment,reddit,,3
ys1fqa,1668149257.0,Volendam is volgens mij officieel geen stad omdat ze nooit stadsrechten hebben gekregen. Het aangelegen Edam is wel een stad,comment,reddit,,2
ys1fqa,1668144101.0,Some of these are quite funny ngl 😂,comment,reddit,,2
ys1fqa,1668151385.0,Hoensbroek is een stad?,comment,reddit,,1
ys1fqa,1668167031.0,Boxtel = Bronxtel,comment,reddit,,1
ys1fqa,1668177539.0,Oosterhout  is Wosterhout,comment,reddit,,1
ys1fqa,1736871731.0,Klopt niks van.,comment,reddit,,1
ys1fqa,1743348597.0,Wtf is dit,comment,reddit,,1
ys1fqa,1668152416.0,"What a shit list, most actual nicknames are not on it.",comment,reddit,,0
ys1fqa,1668148721.0,Geleen = De Waereldsjtad. https://li.m.wikipedia.org/wiki/Gelaen,comment,reddit,,1
ys1fqa,1668155133.0,"Volendam is geen stad maar een dorp, Edam is wel een stad.",comment,reddit,,1
ys1fqa,1668157874.0,Den helder --&gt; Delly City  Ik kan me herinneren dat er een nummer over geschreven is maar ik kan hem even niet vinden helaas,comment,reddit,,1
ys1fqa,1668149398.0,All the carnaval names! And for Eindhoven de Lichtstad.,comment,reddit,,0
ys1fqa,1668146191.0,Lichtenvoorde - Keistad,comment,reddit,,0
ys1fqa,1668148998.0,En Heemskerk noem ik vaak De Hims vernoemd naar de Bims maar daar ben ik denk ik de enige in.,comment,reddit,,0
ys1fqa,1668154145.0,Geldermalsen: Gellie town / G-city,comment,reddit,,0
ys1fqa,1668154624.0,"List is definitely incomplete, not all nicknames, not all cities.",comment,reddit,,0
ys1fqa,1668156182.0,Westside?,comment,reddit,,0
ys1fqa,1668167735.0,Ik mis Zaandiggity Dam,comment,reddit,,0
ys1fqa,1668177413.0,Geertruidenberg is G-town,comment,reddit,,0
ys1fqa,1668179229.0,This sum bullshit you have ally roffa and damsco thats it,comment,reddit,,0
ys1fqa,1668183457.0,"De meeste namen voor Rotterdam zijn either onzin, of word alleen gezegd door mensen die boven de 50 zijn",comment,reddit,,0
ys1fqa,1668203335.0,Je was er een vergeten bij amsterdam: kutstad.,comment,reddit,,0
ys1fqa,1668165465.0,"Hey mensen, dat je bepaalde namen niet kent betekent niet dat het niet bestaat. Er zijn natuurlijk allerlei andere etniciteiten en subculturen die hun eigen 'slang' hebben, waar jij niet bij stilstaat.",comment,reddit,,-2
ys1fqa,1668149306.0,"Yeah, these were all replace by only one common nickname for all of them recently.",comment,reddit,,1
ys1fqa,1668150851.0,"We shorten lichtenvoorde to L,voorde and winterswijk to W,wijk. But thats about it....",comment,reddit,,1
ys1fqa,1668151800.0,Alkmaar wordt ook wel  Kaaskoppenstad genoemd. Vroeger was Alkmaar de kaashandel stad van Nederland.,comment,reddit,,1
ys1fqa,1668152380.0,"Winterswijk: Wiwa, wenters, wwijk Hilversum: Hilly, Hillywood, De Ghetto van het Gooi (niet door mij verzonnen)",comment,reddit,,1
ys1fqa,1668152983.0,Doetinchem: Durkum,comment,reddit,,1
ys1fqa,1668153195.0,"Heu! Anusfoort 🥳 sat once in the bus when i just moved to Amersfoort. I was a bit drunk and really thought the voice of the bus computer anouncing central station said ""Anusfoort centraal""",comment,reddit,,1
ys1fqa,1668153482.0,Westervoort: gangstervoort,comment,reddit,,1
ys1fqa,1668153490.0,"Ik kom uit Hoogeveen en heb hightown en hogga ook nooit gehoord. Wat ik wel vaak hoor is "" 't Hoogeveene"" met een of ander accent terwijl mensen die het zeggen dat accent normaal gesproken niet hebben. (Sorry ik ben heel slecht in accent herkenning.. door de ligging verwacht ik Drents?) Ik hoor dat van zowel mensen die er wonen als mensen die er niet wonen en er over praten.",comment,reddit,,1
ys1fqa,1668154513.0,Heemskerk wordt ook wel eens Heimskirche genoemd.  Hier nog een lijstje van de carnavalsnamen van plaatsen: https://nl.wikipedia.org/wiki/Lijst_van_alternatieve_Nederlandse_plaatsnamen_tijdens_carnaval,comment,reddit,,1
ys1fqa,1668155225.0,Genemuiden - Gaellemuun  The city isn’t on the list though,comment,reddit,,1
ys1fqa,1668155236.0,Alpino aan de rino? Echt nog nooit gehoord,comment,reddit,,1
ys1fqa,1668155350.0,"How did you know that Den Helder is called Dellyfornia? Me and my friends actually came up with that name, one of my friends actually made it into a clothing brand and hosted hip hop shows under the same name, funny to see it on this list, and it’s Delly by the way not Delhi ;).  Edit: never ever heard of le clair btw, I don’t know where you got that one from lol.",comment,reddit,,1
ys1fqa,1668156000.0,"Having lived near Hardenberg for about 23 years, I've heard both Harrie and (the admittedly not-quite-a-nickname) Hard'nbarg. I've heard Hallywood used maybe once or twice, but only as a joke response to calling Zwolle Zwollywood.",comment,reddit,,1
ys1fqa,1668156937.0,Breda: Parel van het Zuiden ;),comment,reddit,,1
ys1fqa,1668157064.0,I remember pluskut from when I lived in Enschede.,comment,reddit,,1
ys1fqa,1668157102.0,"Although 23000 people live there, Heiloo isnt a city.",comment,reddit,,1
ys1fqa,1668157152.0,van Chicago aan de Maas naar Havana aan de Waal.  P.s. de bijnaam van Eindhoven is ook nog Lichtstad.,comment,reddit,,1
ys1fqa,1668157341.0,"Winterswijk: wenters, wenterswiek,",comment,reddit,,1
ys1fqa,1668157368.0,Have absolutely never heard of Horna and HTown for Hoorn. A lot of these nicknames seem made up to me.,comment,reddit,,1
ys1fqa,1668157941.0,Zeewolde: Sneuwolde of Zeewollywood  Maar dat hoor ik vooral van mijn vrienden. Geen idee of het in de algemene volksmond gebruikt wordt,comment,reddit,,1
ys1fqa,1668158069.0,Ik noem Alkmaar altijd [Razorbill](https://en.wikipedia.org/wiki/Razorbill)but. Ben denk ik wel de enige.,comment,reddit,,1
ys1fqa,1668158308.0,Leiden is also definitely Leije,comment,reddit,,1
ys1fqa,1668158331.0,I hear de Veen a lot for Roelofarendsveen,comment,reddit,,1
ys1fqa,1668158919.0,Leusden = Lissa,comment,reddit,,1
ys1fqa,1668159131.0,Enkhuizen: enky town,comment,reddit,,1
ys1fqa,1668159514.0,Alphen aan den Rijn is onder de jeugd ook wel Afval aan den Rijn of gewoon Afval.,comment,reddit,,1
ys1fqa,1668159594.0,Lisse - de Lis,comment,reddit,,1
ys1fqa,1668159790.0,Waalwijk: Wolluk,comment,reddit,,1
ys1fqa,1668159939.0,I was excited but then I saw my city is not on the list and was disappointed,comment,reddit,,1
ys1fqa,1668160095.0,I got another one for you: Skendel for Schijndel. Did not expect Schijndel to show up in this post but miss Sint Oedenrode (Rooi).,comment,reddit,,1
ys1fqa,1668160105.0,Oud Beijerland wordt ook OBL genoemd,comment,reddit,,1
ys1fqa,1668161028.0,"Gorinchem: around my fam and friends we also say Gorkum. And I'm missing my home town, Hardinxveld-Giessendam which we call Hveld-Gdam or just Hveld. :)",comment,reddit,,1
ys1fqa,1668161157.0,Schiedam is Schidda,comment,reddit,,1
ys1fqa,1668161157.0,"groningen: grunn, its the groningse name",comment,reddit,,1
ys1fqa,1668161455.0,Goede post!,comment,reddit,,1
ys1fqa,1668161534.0,"Ik woon in Amersfoort maar heb letterlijk nog nooit van die bijnamen gehoord. Wel van 'Keistad', maar die staat er niet tussen.. Ik mis ook Domstad voor Utrecht",comment,reddit,,1
ys1fqa,1668161539.0,Dordrecht -&gt; Dorro eerder dan Dorra,comment,reddit,,1
ys1fqa,1668161690.0,Bomsko whahahah,comment,reddit,,1
ys1fqa,1668161753.0,Noem Sneek maar gewoon Snits. niet die rare kutnamen,comment,reddit,,1
ys1fqa,1668161816.0,Toevoeging voor Katwijk aan Zee   Kattuk,comment,reddit,,1
ys1fqa,1668161909.0,Die van Delluft heb ik echt nog nooit gehoord.,comment,reddit,,1
ys1fqa,1668162305.0,Aangezien 11/11 geleen = Weareldsjtadt of g-leen046,comment,reddit,,1
ys1fqa,1668162326.0,Rotterdam wordt ook wel eens Maasstad genoemd,comment,reddit,,1
ys1fqa,1668162455.0,Htown 🤣,comment,reddit,,1
ys1fqa,1668162514.0,Tiel - Tiel is nie viel,comment,reddit,,1
ys1fqa,1668162583.0,"Ik ben geboren en woon nog steeds in Amersfoort, en ik heb de meeste echt nog nooit gehoord of gezien. Behalve A'Foort, ja en Keistad (die staat er niet bij)",comment,reddit,,1
ys1fqa,1668162672.0,Oeteldonk mist nog,comment,reddit,,1
ys1fqa,1668162735.0,Weert = Wieërt,comment,reddit,,1
