post_id,created_at,content,content_type,source,url,score
1dtlfnh,1719932318.0,"&gt;Which points to omgevingswet, but that isn't used in Rijswijk yet.  What do you mean? Because the omgevingswet is a law that applies to all of the Netherlands.",comment,reddit,,6
1dtlfnh,1719932491.0,Bestemmingsplan maybe?  You have to go to the Stadhuis in person.,comment,reddit,,2
1dtlfnh,1719935462.0,https://www.helpdeskbouwregels.nl/AfbeeldingById/62  Pdf file from the ministerie,comment,reddit,,1
1dtlfnh,1719944108.0,Rules are always on the website of the municipality. And you always need a permit for this kind of construction work. On the webpage they outline what the requirements are for a permit. Read it and contact Rijswijk if you have questions.   https://www.rijswijk.nl/omgevingsvergunning-bouwen-aanvragen,comment,reddit,,1
1dn6lpv,1719217043.0,Whats your handicap?,comment,reddit,,3
1dn6lpv,1724251419.0,"I (31M) would love to play! I am around 10-15 handicap (haven't played in one year, though)",comment,reddit,,1
1diov0s,1718712352.0,[deleted],comment,reddit,,25
1diov0s,1718722320.0,Little Nepal? My Favourite there,comment,reddit,,11
1diov0s,1718730001.0,Bistro le petit chef is great!,comment,reddit,,10
1diov0s,1718736308.0,"There’s a new Greek that has opened up in Oud Rijswijk. The wines took some getting used to but the Kalfswang memories still have my mouth watering. Good price/quality imo👌.  Le petit chef is my absolute favorite. Definitively more expensive but a very refined selection of wines, lovely shared dining experience and ambiance and some of the nicest people serving.  Can’t go wrong with these.",comment,reddit,,6
1diov0s,1718719134.0,"I would try Indrapura, an indonesian restaurant.",comment,reddit,,5
1diov0s,1718732075.0,Ganzenest,comment,reddit,,2
1diov0s,1718796780.0,"A bit unconventional maybe but De Pannekoekenclub in oud-Rijswijk is awesome. Great service, nice decor and delicious pancakes that can easily serve as a lunch or light dinner. And opposite them is Talamini who make some great icecream.  https://depannenkoekenclub.nl/",comment,reddit,,2
1diov0s,1718718069.0,Which part of rijswijk?  In de Bogaard / the station is quite a way from the old centrum.  Depending where they are staying the answer could vary.,comment,reddit,,2
1diov0s,1718747508.0,De Wits,comment,reddit,,2
1diov0s,1718738315.0,"I haven't been there in a long time but I always really liked ""Het poortje""",comment,reddit,,1
1diov0s,1718816059.0,They could order in from Warung Mini XL Rijswijk. Also vegetarian options and Surinamese cuisine.,comment,reddit,,1
1d56i4u,1717191193.0,"I think your experience will be dependent on where you are staying in Rijswijk. It’s a busier suburb of The Hague and it has good access to freeways and public transit. The areas of Rijswick closest to The Hague are known for being a little “rougher” but that is very subjective.  They aren’t bad IMO but they are not as aesthetically pleasing as other parts of the city. Generally, the closer you are to the beach the nicer the area.",comment,reddit,,6
1d56i4u,1717461500.0,I lived in both cities (at different stages of my life). I loved both but they are quite different imo. Depends on what you want to do there.   For living: - Groningen is great for students. Gets quite lonely during the summer when everyone goes away. - DH is good for professionals and students. It is much bigger and diverse in terms of networking and places to go/visit.  For traveling they are both good options. You gotta see for yourself what you like given that you have the possibility. 🙂,comment,reddit,,1
1d56i4u,1717233801.0,"I love The Hague. However, The Hague has a large immigrant population, including a few neighbourhoods that are mostly Muslim. That's the main difference. They have a disproportionate effect on the downtown. You could say this as well for Rotterdam and Amsterdam.  Utrecht might be better for you, but I don't know. Satellite towns like Haarlem and Leiden might also work for you.  Check out [this thread](https://www.quora.com/What-are-the-good-and-bad-neighborhoods-of-The-Hague-South-Holland-Netherlands).",comment,reddit,,0
1c9rt4n,1713797122.0,Pazze e Pizze? Roman style sheet pan pizza that’s different from the standard pizza but pretty damned good  Pizza’s are made in advance and put in the other to heat to order. Result is a super crispy crunch 🙂,comment,reddit,,3
1c41d9k,1713122257.0,Hahaha sketchy AF,comment,reddit,,7
1b8du3o,1709766351.0,I would recommend either Den Haag Laan van NOI or Holland Spoor station. The first will get you downtown within three tram stops. The latter is about 15 minutes walking or so.   Enjoy your visit!,comment,reddit,,30
1b8du3o,1709769138.0,Plan your trip via [9292.nl](http://9292.nl) to see how much extra time you need to schedule to take busses/trams/metro instead of trains.,comment,reddit,,10
1b8du3o,1709769735.0,"I see you're from Germany? What's your route to the Hague? That way we can properly advise you. I think trams and busses are still going? So if you can reach Den Haag Laan van NOI or Den Haag HS, you can take other forms of transportation as well. You can rent a bike for a small fee per day as well",comment,reddit,,5
1b8du3o,1709771780.0,"Use the Hague HS (hollands spoor) same facility's just as big of a station, and more beautiful. Goes to Delft, Rotterdam and the other side to Leiden en Amsterdam/schiphol airport. Note, from there no trains to Gouda/Utrecht.",comment,reddit,,5
1b8du3o,1709790798.0,HS is open and for rijswijk is perfect. In Tram it will be 5mins from there,comment,reddit,,2
1b8du3o,1709850850.0,Tram 16 or 17 Goes to wateringen and wateringse veld. 17 will also cross Rijswijk.,comment,reddit,,1
1ad37h2,1706451031.0,Zuliani's in Stadshart Zoetermeer naast AHxl misschien.,comment,reddit,,8
1ad37h2,1706456959.0,Delft centrum! Bij de oude kerk,comment,reddit,,5
1ad37h2,1706454457.0,"Van kempen had vandaag nog oliebollen, op kijkduin. Ze zijn  best lekker.",comment,reddit,,3
1ad37h2,1706476985.0,Oud Rijswijk. Bakkerij Bosman,comment,reddit,,3
1ad37h2,1706508425.0,Oud Rijswijk centrum. Bakker Bosman,comment,reddit,,3
18uek86,1703980099.0,"Hi man, this message is coming from someone who lives in Wateringen. Wateringen is pretty decent I should say. It’s quite calm here, so you definitely won’t notice you’re living close to a major city. Wateringen is tiny though. If you are used to the big city it will definitely be a shock. Only a few supermarkets and a few restaurants are near the center of Wateringen.   I would love to only stay positive, but I have to warn you that criminality is picking up in rapid fashion. A few months ago there were multiple shootings, and the burglaries are also picking up fast. It’s not as bad as it is in some other places in the city center, but it definitely is something I want to warn you about.   I don’t know about the situation in your family but both some primary schools, secondary schools and a international school are very close.  If you have some more questions about certain parts of Wateringen or general questions, I would love to help you!",comment,reddit,,5
18uek86,1704021129.0,"Hi again!   I don’t really notice it on a daily base, altough around New Years Eve it’s always a bit less restless with loads of fireworks. But I think that’s usual stuff right now in and around The Hague. You definitely won’t find a criminal on every corner, don’t worry about that!  It’s hard to give you a specific area as they are not really named in Wateringen, but I’ll give you some street names of good and bad areas so you can find out whether the location you’re looking for is close to that!  Areas I would NOT recommend are: the areas around ‘Laan van Wateringse Veld’ and ‘Parijsplein’ (most criminality).   Areas I WOULD recommend though are anywhere around ‘Esselanden’ (has a primary school, close to the center of Wateringen, close to the highway and close to the trams). Also areas around the ‘Kerklaan’ (basically the center of Wateringen, you can search it up in Google Maps) are recommended. Close to the center with the most supermarkets and other shops, does have a primary school as well and has some playgrounds near for the kids! Also has a great vibe around Sinterklaas or other festivities. Both are also close to sportsclubs such as KMD (football), VELO (football, handball or judo) etc.   Everything around ‘Kwaklaan’ is also recommended, because it’s close to basically everything. Sportsclubs are close as well, and it’s a bit more modern than the other 2 options.   In your situation I think I would prefer areas around ‘Kerklaan’!   If you want to ask anything about a specific street you saw a house in or the area around it, do not hesitate to connect me again!",comment,reddit,,5
16zkbw8,1696434847.0,"Nee, maar ik kan vouchen voor rijschool Klink goed in rijswijk. Nadat ik een nalatige rijinstructeur heb gehad heeft deze eenmans rijschool de tijd genomen om dingen op mijn manier aan te leren. Hij is te vinden op insta.",comment,reddit,,1
16je47e,1694863190.0,"Would love to join, was just looking at places to play fusball so perfect timing",comment,reddit,,2
16je47e,1694878230.0,Is it open for Dutch people as well? If so I’d like to join! Also new in The Hague :-),comment,reddit,,2
16je47e,1694933201.0,"I'd like to join aswell, still spots left?",comment,reddit,,2
16je47e,1694986422.0,Hi! I would like to join!,comment,reddit,,2
16je47e,1738527973.0,"Hello, just moved The Hague and looking to play regularly futsal. Is this team still accepting new players ?",comment,reddit,,2
16je47e,1712916123.0,"Is this still available? I’d like to join, I just started playing on Fridays but it’s not regularly. They already got fixed teams, so I don’t play every Friday unfortunately. So Thursday with fixed teams would be awesome 😎 let me know if it’s still available for me to join",comment,reddit,,1
16je47e,1713445765.0,"Hello, I would love to join from time to time and my girlfriend would too. Do you still have some slots?",comment,reddit,,1
16je47e,1758716130.0,"Hey, do you guys still play?",comment,reddit,,1
16je47e,1695163066.0,Hi! I would be really interested in joining the games! Are there still any available spots? Thanks!,comment,reddit,,1
16je47e,1703333183.0,"Hi! My boyfriend would be interested in joining you some time! Is there still space on the team, or would there be in the future?",comment,reddit,,1
16je47e,1707496692.0,Hi there. I am bit late but I am interested as well and I live 15min biking away from the place. Is this still happening?,comment,reddit,,1
14jmpzs,1687810459.0,I always recommend Sushi Lola! https://www.sushilola.nl/en/menu-en-2/,comment,reddit,,8
14jmpzs,1687841741.0,"Kyatcha is, in my opinion, by far the best sushi in the city. That being said, it is quite expensive so more of a once in a while treat.",comment,reddit,,5
14jmpzs,1687849159.0,"For the best, probably Kyatcha. It’s hella pricy though. Another pricy option is Catch by Simonis, it’s a fish shop/restaurant but their sushi is pretty good.   Mid tier, Sushi Lola is alright as well. My personal favourite is Ohmu. Ohmu’a rice is a bit different, but they have great flavour combos.  Quick fix, those sushi daily stalls in AH (the ones they make fresh in store) are pretty decent as well",comment,reddit,,4
14jmpzs,1687810555.0,Oni,comment,reddit,,3
14jmpzs,1687815360.0,"Sushi meisjes, Momiji, Akihito",comment,reddit,,3
14jmpzs,1687853343.0,"I personally love Dozo. However, I don't think that they do deliveries anymore, but you can visit their restaurant. For takeaway, I like Sushi Wereld and Momiji. However, if you don't live bear Rijswijk, it might take a while for your delivery to get to your door.",comment,reddit,,3
14jmpzs,1687867059.0,[removed],comment,reddit,,3
14jmpzs,1687799131.0,ohana sushi oni Kiraku,comment,reddit,,4
14jmpzs,1687810732.0,"Benkei is by far my favorite, run by an old Japanese guy. Super friendly and the best sushi. Forget all that takeout nonsense",comment,reddit,,4
14jmpzs,1687896459.0,Sushi Morikawa,comment,reddit,,2
14jmpzs,1687983710.0,"Most of them would be nice, Den  Haag has many high quality restaurants from most cuisine, of course also Asian. Just order from a place which has 4 stars at least then you are fine",comment,reddit,,2
14jmpzs,1687815101.0,Sushi meisjes,comment,reddit,,1
14jmpzs,1731680354.0,OP have you tried any? Which was good? I'm craving sushi (sick now..) so when I get better wanna order some..,comment,reddit,,1
14jmpzs,1687865690.0,I haven't tried all of them but Ohana is very good in my opinion.,comment,reddit,,1
14jmpzs,1688196785.0,Cafe in the city definitely!,comment,reddit,,1
14gzxsz,1687541155.0,"The one in Rijswijk is not much of an issue, but keep everyone hydrated! For the one in Voorburg, absolutely additional pitchers of water and everyone wearing with tank tops and shorts.",comment,reddit,,2
14gzxsz,1687540176.0,"Just make sure everyone drinks a lot (of water). If it gets too hot, monkey town closes (early).",comment,reddit,,1
142sth2,1686113662.0,"Start looking ASAP if you want to be in a city center. Your budget will make the biggest difference in availability. You'll find that the supply around €800/month is **very** tight. If you're looking in the €1,800/mo range, you'll find more options.  Of the places you've listed, Cappella, Zoetermeer and Voorburg will be more affordable. Though you will pay for your commutes in time and money.  Where do you need to be for work? Will you have a car?   Commuting by bike is by far the best option and anything less than 10k is **extremely** practical and possible. Bus, tram and train options are great, but due to connections can take a long time.  For example, i have a 13k bike commute from Statenkwartier Den Haag to North Wassenaar. It takes: * 27 minutes of *fast* cycling on a road bike * 30-60 minutes in the car (traffic is stupid **DUMB** some mornings) * 60 minutes by bus with 1 transfer at DH Central",comment,reddit,,4
142sth2,1686154166.0,True gamblers and filthy rich people start on August 31.,comment,reddit,,3
142sth2,1686128434.0,"I'm sorry but I'm just loving ""bezedenhuit"" . 😅",comment,reddit,,2
142sth2,1686132252.0,September 2022,comment,reddit,,2
142sth2,1686145393.0,10 years ago.  Don't underestimate the housing crisis right now. Unless you're paying 3k plus a month and 3 times a down-payment.,comment,reddit,,2
142sth2,1686150400.0,[deleted],comment,reddit,,2
13wvjz4,1685569521.0,"Heey Flobin,  Ik ben wel geïnteresseerd om onze Reddit te voorzien van extra hulp. Dit is een nieuw account dit ik heb aangemaakt voor mijn YouTube kanaal. Wellicht heb je al wat filmpjes voorbij zien komen. Ik hoor het wel.  Met vriendelijke groet DutchAdventures / Nando",comment,reddit,,3
13wvjz4,1685581392.0,"Hola,   I’d like to volunteer. From The Hague, in the US now so I’ll be on a different time zone which could be helpful.",comment,reddit,,3
13wvjz4,1685661523.0,"Geboren en getogen Hagenees (M/34) met een IT achtergrond die meer op Reddit zit dan gezond is. Sinds enige tijd ook in een aantal Nederlandse subs waaronder deze en dat bevalt me tot dusver enorm.  Heb geen ervaring met het moderaten van een subreddit maar wel met het opzetten/inrichten/stijlen en de moderatie van forums, social media accounts &amp; discord communities.",comment,reddit,,2
13wvjz4,1685568118.0,How much time does it take?,comment,reddit,,1
13wvjz4,1685585209.0,Happy to assist you.,comment,reddit,,1
13wvjz4,1685587169.0,Hey! Dutch / English speaker here. Happy to help out! I have community management / moderating experience aswel :),comment,reddit,,1
13wvjz4,1685598136.0,I would like to moderate but have a weakness for power. Everyone would get banned by even looking funny at me.,comment,reddit,,1
13wvjz4,1685609999.0,I'm pretty much always browsing reddit at background while work/study. I'd like to fill up a spot if there is help needed.,comment,reddit,,1
13wvjz4,1685691096.0,would love to help since I know the hague very intimately for more than 25 years. but I don't live there any more and my account is not old,comment,reddit,,1
13aq1u3,1683470583.0,"Safe, but can be trashy sometimes. As in lots of trash next to containers or just on the street.  Aside from that, relatively decent place to live in. Close to Hollands spoor, well placed within the hague. Lorentzplein, with supermarkets and bakeries. Big "" mall"" called megastores also nearby (which I think will be closed in the near future).   Edit: oh and I just read you're a student. Then pretty good to live in yeah. Close to hogeschool den Haag, or train station for any other school. Some good places to eat, lots of choice for nearby Thuisbezorgd deliveries if that's your thing.",comment,reddit,,38
13aq1u3,1683477010.0,"there are no really unsafe areas in the Netherlands, in the US sense.",comment,reddit,,61
13aq1u3,1683476508.0,"Lived here 10 years, it’s fine and safe. Bit rough around the edges but that just means rent is a little cheaper.",comment,reddit,,12
13aq1u3,1683483239.0,"In the Netherlands there are better and worse areas, but generally there really aren't any no-go zones. Just be cautious like normal wherever you live. You can sometimes be unsafe in the best of areas while being perfectly safe in some of the worst",comment,reddit,,7
13aq1u3,1683484771.0,"I'd say it depends on if you're a man or a woman. We lived there for 3 years. My SO (male, 6ft4 and broad shouldered + bushy bearded) loved it, I (female, 5f10) got harassed on a daily basis. We were also frequently approached by other women to walk them home, and I never went anywhere alone after dark.  I got out of there as quickly as we could.",comment,reddit,,9
13aq1u3,1683477012.0,You are safe everywhere in the Hague.,comment,reddit,,12
13aq1u3,1683483902.0,"Blue collar and a lot of Muslim inhabitants. If you are a woman you might not feel safe if you’re not Muslim. For Dutch standards it’s an unsafe low class place. Rough around the edges.   But internationally you can consider it safe. No drive-by shootings or such.   Avoid going out with soccer matches of Turkey and Morocco. In summer there might be some unrest, as with New Year’s Eve.  Turkish and Moroccan bakeries and supermarkets are great though.",comment,reddit,,10
13aq1u3,1683471623.0,"Avoid the big roadcrossings during football season, there will be riots. Also a lot of fireworks and street fires during new years eve.  Altogether a noisy, lower middle class neighborhood but not, in itself, extra unsafe. If you fit in (or at least make an effort: ""geen kapsones"") you'll be allright.",comment,reddit,,5
13aq1u3,1683486152.0,Not if you're a woman.,comment,reddit,,5
13aq1u3,1683472286.0,Not if you're a blonde woman. It's not unsafe but you'll be harassed continuously by the Elefants in The Room that Shall not be Named.,comment,reddit,,18
13aq1u3,1683473221.0,"Quite safe, but I would still be there like ‘see no evil, hear no evil’. Mixed up area, you will live among extreme muslim people and extreme right white people. Both will not be the richest peeps in town.",comment,reddit,,5
13aq1u3,1683482639.0,"I would say no, but I am sure leftminded reddit will disagree with me about that.   My best friend used to life there and I went allot to that neighborhood, its trashy as hell and 90% is muslim.",comment,reddit,,6
13aq1u3,1683478218.0,"Try this one: https://leefbaarometer.nl/home.php From the Dutch government, just put in the zipcode, the greener the area the better",comment,reddit,,2
13aq1u3,1683490736.0,Everyone saying it’s safe; as a woman I can tell you it isn’t safe and I actively avoid that area due to negative experiences unfortunately,comment,reddit,,2
13aq1u3,1683495422.0,"Unsafe? No. Uneasy? Yes, if you're a female or non-muslim (or both). You will need to learn the art of ignoring and avoiding.",comment,reddit,,2
13aq1u3,1683633489.0,Yes! I live literally in that circle. I am a guy though so it is probably a bit easier for me to live there safely by myself. But I known of a few women that live there and they say that its not that bad.,comment,reddit,,2
13aq1u3,1683478675.0,My parents in law live in that exact area. You'll be fine,comment,reddit,,3
13aq1u3,1683471141.0,"I love Reddit, thanks so much for your feedback!",comment,reddit,,2
13aq1u3,1683482158.0,"It all depends on who you are and where your from, but if you’re just a tiny bit streetwise the Netherlands are safe everywhere",comment,reddit,,2
13aq1u3,1683476431.0,"Its orety okai, bit muslim heavy wich make social controll nice, good food around  I used to have a best friend there 5 years ago never felt unsafe",comment,reddit,,2
13aq1u3,1683481336.0,nope,comment,reddit,,0
13aq1u3,1683473327.0,Yes,comment,reddit,,0
13aq1u3,1683477862.0,"It’s a no-go area where politicians are set on fire!  Edit: it’s a reference to Pete Hoekstra, can’t you guys recognise a joke when you see one?",comment,reddit,,-2
13aq1u3,1683473837.0,you’ll be fine everywhere. usually people are just minding their own business. individualism is a big thing here so just do your thing and you’ll be good.,comment,reddit,,1
13aq1u3,1683484029.0,"From the USA?  You are fine, throw a dart at a map and you are fine.   Unless you are one of the lunatics that only feel safe when they have a piece on em.",comment,reddit,,1
13aq1u3,1683487920.0,For you it’s safe. But it is not the cleanest or well taken care of in comparison to other neighborhoods. It is also very “diverse”,comment,reddit,,1
13aq1u3,1683488742.0,"As long as you don’t associate yourself with a drill rap gang, you will be fine. Lived there for a long time, and had a great time. Never felt unsafe.",comment,reddit,,1
13aq1u3,1683494478.0,"It's generally safe, I'm born and raised in that neighborhood. There will definitely be some catcalling happening when you're a female, especially if there are a group of boys hanging out (hangjongeren), but most of them are harmless.",comment,reddit,,1
13aq1u3,1683496983.0,Rijswijk is save! Its the neet place of The Hague. Don’t go to Rotterdam!!,comment,reddit,,1
13aq1u3,1683500158.0,"Yeah, it's fine. I've lived on the edge of that circle for years and been fine",comment,reddit,,1
13aq1u3,1683502333.0,not a safe place for women,comment,reddit,,1
13aq1u3,1683528812.0,well at least your not in rotterdam,comment,reddit,,1
13aq1u3,1683529418.0,"They all are, this is Holland.",comment,reddit,,1
13aq1u3,1683532481.0,"Well, safe maybe, but I moved out as fast as I could. Wouldn’t want to live there anymore.",comment,reddit,,1
13aq1u3,1683537692.0,"Safe or not, it will be adventurous for sure",comment,reddit,,1
13aq1u3,1683541521.0,"It's not unsafe, but it can be uneasy on some days.      That area used to be part of my running route before I moved to another area. I have had incidents where older men would slow down their bikes to follow me for short period of time, or kids would throw trash or fireworks (during Sinterklaus) at me. It didn't happen often, but it did in broad daylight. It didn't happen often, but it was super upsetting the few times it did happen.     For reference, I am 5'3 and and East Asian decent.",comment,reddit,,1
13aq1u3,1683543236.0,Laakkwartier is the best option of the two imho,comment,reddit,,1
13aq1u3,1683545346.0,Well it’s safe but it’s not the best neighborhood in The Hague,comment,reddit,,1
13aq1u3,1683547864.0,"I litteraly used to live 10 min away from there about a year ago. I lived in the Hague all my life. A lot of my colleages live there.  The area is called Spoorwijk and is very crowded (too much for my taste). There are lots of foreign restaurants and shops there and the streets has lots of trafic. You'll find lots of people from many cultures there. It's generaly peacefull during the day when I went there, but it is quiete common if there is a commotion. If you keep minding your own business, it should definetely be safe. Just know that crime is still a thing. I wouldn't show off, if you have expensive equipment or at least keep it safely stored. Bicycles are never safe. But that is the Netherlands for you. Also depending if you're a man or woman, you can expect harassment as there are lots of loiters and jobless people there.  The location itself is great as everything is very close and easily reachable, even if you were on foot. If you need to go further, you can take the tram and or bus. A bicycle would be ideal as you would avoid most traffic and saves you a lot of money. If you have a car, it is almost impossible to find a parking spot after working hours. Going more southeast, there you find more parks if you want to take a peacefull walk.  In my honest opinion, I wouldn't want to live there for a long time. But if it was for a short while, then yeah, it would be definetely be okay. That totally depends on your taste,  Doing a quick search on Spoorwijk and safety: I see many articles stating that it's very unsafe and even one mentioning that it is the worst neighbourhood in Holland.  [https://veiligspoorwijk.wordpress.com/2021/09/16/laakkwartier-oost-is-slechtste-buurt-van-nederland/](https://veiligspoorwijk.wordpress.com/2021/09/16/laakkwartier-oost-is-slechtste-buurt-van-nederland/)  Good luck!  &amp;#x200B;  Edit: Made some edits",comment,reddit,,1
13aq1u3,1683550927.0,"I remember almost 6 years ago where Rotterdam was so safe that I barely encounter mess and riots etc. (Besides seeing one man attempted to murder my neighbour, but thats when u just mess with other people etc.) Mostly just discrimination, and for the additional fact , I even lived in Zuid. But I think as long as you know ur street and try to live with the street (people). You’ll be fine.",comment,reddit,,1
