post_id,created_at,content,content_type,source,url,score
1lann6b,1749850812.0,"Statenkwartier:  Upscale neighborhood with an international 'vibe', almost has more expats (predominantly German and French, but from all corners of Europe) than Dutch natives.   Oud Rijswijk:  Not a part of The Hague (municipality), I'm not really qualified to say anything about it.  Voorburg:  Also (technically) not a part of The Hague (municipality), but close enough. Solid middle class neighborhood, but not a lot going on.  Valkenboskwartier:  Gentrifying, has good and bad parts. Right in between the 'good' and 'bad' parts of town.  Rustenburg:  Lower class neighborhood, but not the worst.",comment,reddit,,4
1lann6b,1749852865.0,"So, I’ve been a Voorburger for a year now.  It’s indeed more quiet and less active than some other places, but if you’re looking for that relaxed and homey atmosphere, you may just as well find it there.  It’s pretty close to the center, but can vary depending on where exactly you find yourself at. I’m close to Laan Van NOI so it’s rather convenient going both to the city center, but also importantly outside, to, say, Amsterdam for work.  If you consider future potential, as well, some of the areas, like Voorburg, can be expected to develop and liven up a bit based on announced development projects- but I’ve not been here long enough to say if this will pan out, and to what extent.",comment,reddit,,3
1lann6b,1749859071.0,"Used to live in The Hague … lived in Zeeheldenkwartier, which was fantastic.  Had friends who lived in Statenkwartier, Voorburg (who then moved to Oude Rijswijk)… Voorburg was the least exciting of the bunch.  There are plenty of fun things to do in Statenkwartier and Oude Rijswijk (which is also close enough to Delft to get to but short bike ride).  Can’t go wrong in either of those two places.",comment,reddit,,3
1lann6b,1749841121.0,"Rustenburg is the odd one out, others are kind off similar",comment,reddit,,3
1lann6b,1749884432.0,"All the mentioned neigborhoods are excellent. The north part of the city is chill and quit you wont make a mistake wherever you decide the settle. Currently we bought an  apartmant in Vruchtenbuurt area, it is close to the beach, we have a lot of shops but most important the Alber Heijn xl is quite close which they work on sundays also :)",comment,reddit,,2
1lann6b,1749889313.0,All of them are beautiful localities. Voorburg has a lot of indian presence....if that interests you.,comment,reddit,,2
1lann6b,1750099674.0,"I have lived in Rustenberg Oostbroek for two years now and it is a mostly nice neighbourhood which can be very beautiful in the summertime especially as we have Zuiderpark. For the most part it feels safe here but I will say that I have been sexually harassed while outside on my own more times than I can count. This was especially jarring to come to terms with having moved from Ireland where that has almost never happened to me. It’s to the point that I have started to even change the way I dress as I don’t feel comfortable going outside alone with even my shoulders showing, which is unfortunate. I’m not sure if this is a neighbourhood issue or not as I do not have the experience of having lived elsewhere in Den Haag",comment,reddit,,2
1lann6b,1749848578.0,"See below the copy of one of my previous more extensive comments on neighbourhoods in The Hague.   [https://www.reddit.com/r/TheHague/comments/1l35j28/comment/mwbhvga/?context=3](https://www.reddit.com/r/TheHague/comments/1l35j28/comment/mwbhvga/?context=3)  Given you said you want a mix and a place you can raise kids in the future. I would recommend these 4 neighbourshoods:      Regentesse Kwartier   Valkenbos Kwartier   Zee Helder Kwartier   Bezuidenhout  These seem to be the most sort of lively areas with you professional. Most other nieghbourhoods will be much more quite or lively but less kid friendly.  Oud rijswijk en Voorburrg are both nice, but wil just be much more quite.  Staten Kwartier is one the most beautifull (and expensive) neighbourhoods in the Netherlands, so if you can afford it definitly go for it. But in that case you could also check out Belgische Park &amp; Archipel Buurt.  Like others already said Rustenburg is the odd one out in you list it seem to be a neighbourhood in transation, so if your buying you might see the most value appricaiation as the neighbourhoods shifts from working class to more urban profesionals.",comment,reddit,,2
1lann6b,1749901499.0,"Oud Rijswijk is very nice! It's also really small, so you know, not much here and what we have are small scale. But if you don't mind that, you have your life needs all covered here, and it's got a bit of that village vibe when you go into the side streets. It's like each street is its own little village where people all know each other and extended family live in different homes on the street.",comment,reddit,,1
1lann6b,1749930221.0,"You did not ask, but you might want to consider De Bras neighbourhood in Ypenburg. Friendly, and 10 minutes biking to the lively city of Delft.",comment,reddit,,1
1lann6b,1749932729.0,"Valkenboskwartier and Statenkwartier are great, definitely would recommend.   With a slight prefererence for Valkenboskwartier",comment,reddit,,1
1lann6b,1750179371.0,I live in rustenburg pretty chill just a lot of junks but that’s just the hauge the only places I know are dangerous is laakwatier and schilderswijk but normally the hauge is chill in my perspective,comment,reddit,,1
1lann6b,1749841657.0,Te degelijk en veel te ver from the beach for me 🏄🏼‍♂️.,comment,reddit,,1
1lann6b,1749858125.0,"Dont move here please, no housing and way too many expats",comment,reddit,,-7
1lann6b,1749854910.0,I aint doing your homework. Learn dutch.,comment,reddit,,-8
1laly6n,1749856169.0,"Love living in oud Rijswijk. Somehow, it feels like living in a village, market around the church on Saturday and neighbors knowing and greeting each other in the streets.  But at the same time, if you want to enjoy city life, you can quickly get to the center of Den Hague for some action. Not all areas of Rijswijk are good but so far I'm very much enjoying living here.",comment,reddit,,15
1laly6n,1749853871.0,"Hi there! I used to live in Oud Rijswijk and I can say it’s a really nice neighbourhood. Pretty safe, family friendly and much less chaotic than Den Haag imo. If you have a car, the only downside could be to find a parking spot next to your house. Feel free to ask more specific questions via DM if you’d like :)",comment,reddit,,6
1laly6n,1749855330.0,De Herenstraat has some nice bars and restaurants. It's fine.,comment,reddit,,6
1laly6n,1749861371.0,The First Rule about Oud-Rijswijk is that you don't talk about Oud-Rijswijk...  It is a small close knit area with a nice Saturday Market. just forget about street parking close by your home.,comment,reddit,,8
1laly6n,1749976024.0,"I live pretty close to the edge of Oud Rijswijk, and whenever I go for walks I always end up there. It's so beautiful and green, I'd love to live there one day. My regular pub's there too, so bonus points on that front!",comment,reddit,,2
1laly6n,1749900034.0,Parking is crap but a really lovely neighborhood. I don't live there but want to live there,comment,reddit,,1
1laly6n,1750021702.0,"I loved living there! There’s all the facilities, you’re very close to The Hague as well as the highway and it’s connected to some large green area. Overall very cozy and comfortable. The people are also fine",comment,reddit,,1
1laly6n,1749853662.0,"It’s got good and bad parts imo (almost bought a house there last year but opted for Scheveningen instead for many many reasons). But if you don’t care about politics and don’t have friends living in other areas far away, then it’s a good location, and I think it’s family friendly too.",comment,reddit,,0
1laly6n,1749857641.0,We locals cant find houses because of you,comment,reddit,,-35
1kjxs5s,1746962974.0,Nieuwemensenlerenkennen.nl  Ik zit er ook op in dezelfde regio. Best leuk om gewoon eens wat te ondernemen met onbekenden.,comment,reddit,,7
1kjxs5s,1746976370.0,Rip DM’s,comment,reddit,,5
1kjxs5s,1747043740.0,De podcast Steeds meer singles heeft ook een appgroep die zeer actief is in Den Haag. Dan moet je ze even mailen en kan je toegevoegd worden. Ik als F32 ervaar dit als zeer prettig. En ik zie dat Nieuwe Mensen Leren Kennen (NMLK) ook al benoemd is en hier ben ik ook actief! Zeer leuk om spontane dingen te ondernemen.,comment,reddit,,3
1kjxs5s,1746959209.0,Hoi! 33f hier. Waar rijd je paard? Ik mis dat heel erg maar ik ben nogal lang (1.83) dus dacht altijd dat ik automatisch te zwaar zou zijn tegenwoordig..,comment,reddit,,2
1kjxs5s,1746976135.0,"33f ook uit Rijswijk :) als je een x bakkie wil doen bij de Bogaard , lijkt me gezellig. Of naar de kroeg.",comment,reddit,,1
1kjxs5s,1747029333.0,"Hello, i am from India and live in The hague.  Donping me and we can further discuss,  lets see how it goes",comment,reddit,,1
1kjxs5s,1747047020.0,"Thanks voor deze post en comments.  Ik wist NLMK niet, dus dank daarvoor. Ik m34 ben ook nieuwe in Den Haag. Ik zou het leuk vinden om een bakkie te doen",comment,reddit,,1
1kjxs5s,1747059811.0,Heb je Bumble friends al eens geprobeerd?,comment,reddit,,1
1kjxs5s,1747081841.0,Leuk! Woon sinds kort in Den Haag dus wie weet!,comment,reddit,,1
1kjxs5s,1747089082.0,"Ik ben ook een vrouw van 36, maar woon in Voorburg!",comment,reddit,,1
1kjxs5s,1747126529.0,"Man van 34, op zoek naar nieuwe contacten na 3 jaar medisch gedoe. Ga graag (strand)wandelen en ben breed geinteresseerd in goede gesprekken (filosofie, theologie, muziek, etc. etc. etc.)  Groetjes",comment,reddit,,1
1kjxs5s,1747135315.0,Iemand met een hond? Samen hond uitlaten in clingendael lijkt me leuk,comment,reddit,,1
1kjxs5s,1747175061.0,"Hoihoi, 39 jarige kerel hier en ik woon in Den Haag  tegen Rijswijk aan.  Ik sta eventueel wel open voor gezellig een wandeling of wat dan ook, dm maar als je interesse hebt.",comment,reddit,,1
1kjxs5s,1747372142.0,Voeg me ff toe lijkt me lache,comment,reddit,,1
1kjxs5s,1747857405.0,"Hi! Ik ben (bijna)34, vrouw, sinds eind september woon ik in Rijswijk en herken veel in wat je zegt (van de levensfase tot de goede gesprekken tot het wandelen tot de films). Lijk me leuk om inderdaad kennis te maken als je daar nog behoefte aan hebt, stuur in dat geval gerust een DM!",comment,reddit,,1
1kjxs5s,1746961458.0,29M net 6 maanden terug in NL na een tijd in het buitenland en ik vind het ook lastig om vrienden te maken hier. Zou graag een bakkie willen doen.,comment,reddit,,1
1kjxs5s,1746976301.0,Misschien mijn ex. Ze is 40 en een best wijf. Woonachtig vlakbij de bogaart,comment,reddit,,1
1jretb2,1743790787.0,"What a beautiful view on the shy line, never seen it that way before.",comment,reddit,,7
1jretb2,1743791609.0,Skyline Den Haag &gt; Rotterdam,comment,reddit,,9
1jretb2,1743790324.0,Mooiste stad 😍,comment,reddit,,4
1jretb2,1743787885.0,"Nice pic, who made it?",comment,reddit,,3
1jretb2,1743789321.0,Love it!,comment,reddit,,3
1jretb2,1743805907.0,"Mooi! Lekker gevulde skyline vanuit deze hoek, denk dat deze foto het goed zou doen op r/skyscrapers",comment,reddit,,2
1jretb2,1743793815.0,Sjelelele,comment,reddit,,1
1ji0p1j,1742743692.0,"The problem lately that, as you stated, there is alot of real crap or the semi proffesional seller.  We used to go there about every year for two days and we had the more sellable stuff with alot of cassettes and cd’s for 50cent each. These 50cent items are fastsellers and will get you alot buyers ( and dudes wandering through each and every cd )… Clothes are sellable but alot of foreign women are making a huge mess of it and even are complaining if you ask decent prices ( like €2 for a jeans… ) and won’t leave you alone…",comment,reddit,,4
1ja63w3,1741849139.0,Try the Koorenhuis,comment,reddit,,3
1ja63w3,1741859361.0,"I know there's a music cafe with live jazz practically next door to O'Casey's, maybe the people there would have an idea?",comment,reddit,,2
1ja63w3,1741902072.0,Try ready2play r2p.nl,comment,reddit,,2
1ja63w3,1741905287.0,Go to the conservatory and ask if they got students who also give lessons.,comment,reddit,,2
1ja63w3,1741870874.0,There are cheaper ways to annoy your neighbors than learning a brass instrument.,comment,reddit,,-1
1j1ouyu,1740916241.0,https://www.hzzian.nl/zwemles/opleidingen/baby-peuterzwemmen (Vaccinations required),comment,reddit,,4
1j1ouyu,1740921082.0,"We took both our boys to Mulder sport from 6 weeks old. Not sure if it's cheap, did never compare it.  https://www.muldersport.nl/zwemmen/babyzwemmen-11-24-16/  https://maps.app.goo.gl/iWAwvpVxPMPDGex69",comment,reddit,,3
1j1ouyu,1740916684.0,https://www.forumkwadraat.nl/activiteiten/baby-en-peuterzwemmen/,comment,reddit,,2
1j1ouyu,1740959965.0,"The municipality offers 'teddy bear swimming' for toddlers age 1 and over: https://socialekaartdenhaag.nl/ak-assistance/teddybeerzwemmen/. I have never used it so can't say whether it's good or useful.  Proper swimming lessons are from age 6 and up. Municipal swimming lessons are quite cheap, but there is often a wait list.",comment,reddit,,2
1j1ouyu,1740921688.0,Wassenaar sterrenbad,comment,reddit,,1
1j03ld4,1740734662.0,Glashandel Ariba might be able to help,comment,reddit,,2
1izksnc,1740679474.0,En dat post je in de subreddit voor Den Haag,comment,reddit,,42
1izksnc,1740678121.0,Een belevenis an sich.,comment,reddit,,3
1izksnc,1740735106.0,Das wel komisch,comment,reddit,,2
1izksnc,1740732468.0,Lol Rijswijk poaching members from other cities?,comment,reddit,,1
1ihovvz,1738696182.0,Le Duc op Noordeinde is een leuke bar met vaak live Jazz. Of Murphy’s law.,comment,reddit,,6
1ihovvz,1738698398.0,Elke dinsdag cafe september op grote markt live jazz avond,comment,reddit,,7
1ihovvz,1738694891.0,"Enigzins in de buurt, in Delft zit de Bebop waar er wekelijks jamsessies en optredens zijn, altijd gezellig!   Edit: even de toevoeging dat dit om jazz gaat!",comment,reddit,,6
1ihovvz,1738699962.0,"Jazz café Dizzy in Rotterdam is also quite nice, bit further away though",comment,reddit,,5
1ihovvz,1738699845.0,Ik organiseer een paar x per jaar een reggae/dub feestje. Er is niet heel veel reggae in Den Haag. Soms zijn er reggae optredens/festivallen in Den Haag maar ik ken geen plek die het standaard draait. Denk dat je het echt van evenementen moet hebben.,comment,reddit,,5
1ihovvz,1738702027.0,De website livejazzinthehague.com heeft alle jazz in de stad. Er is altijd wel wat.,comment,reddit,,3
1ihovvz,1738705091.0,22 februari in het Cultuurlab in Delft Reggaenight in samenwerking met Rastaplas- dat is een reggae festival in Zoetermeer. Dit jaar 20ste editie op 18 en 19 juli.   http://www.cultuurlab.nl/  https://www.rastaplas.nl/nl/,comment,reddit,,3
1ihovvz,1738738456.0,"Murphy’s Law had vroeger wel eens jazz avond!  Ik weet niet of ze het nog steeds doen, maar de moeite waard om even te checken.",comment,reddit,,2
1ihovvz,1738744564.0,Jazz cafe twee spieghels in Leiden,comment,reddit,,2
1ihovvz,1739128461.0,le duc en september op dinsdagen (grote markt),comment,reddit,,2
1ihovvz,1760249285.0,"Ken je de app Jamr al? Deze geeft een overzicht van alle lokale live muziek in de buurt. Veel podia in Den Haag staan er al in, nog niet allemaal maar dat komt vanzelf. Www.jamr.live voor meer info en iOS en Android versie gewoon te krijgen in de store. Eindelijk een overzicht van ALLE podia en optredens in een stad!",comment,reddit,,2
1hyv8aw,1736599886.0,"""Hi. Automoderator has detected you may be asking for advice regarding meeting new people in The Hague. Questions like these get asked very often in this subreddit. Please post in our monthly thread regarding these issues (or use the search function to find earlier posts).    *I am a bot, and this action was performed automatically. Please [contact the moderators of this subreddit](/message/compose/?to=/r/TheHague) if you have any questions or concerns.*",comment,reddit,,1
1hyv8aw,1736601509.0,What a nice gesture.  I’ll try to call in for a cup of tea.,comment,reddit,,5
1hyv8aw,1736661173.0,"Sounds cute, I'm in!",comment,reddit,,2
1hyv8aw,1736677581.0,"This sounds nice! Do you plan to hold the event in English, mostly?",comment,reddit,,2
1hyv8aw,1736678227.0,"Would it be interesribg if I bring my sowing machine? I'm interested to learn from others since I just got it for Christmas l, but maybe we can learn together",comment,reddit,,2
1hyv8aw,1736678421.0,Was looking for an event like this! Will be there 🥳,comment,reddit,,2
1hyv8aw,1736720518.0,Love the idea! Can’t make it to this one but definitely wish to join if you do an event next month. :),comment,reddit,,2
1hyv8aw,1749908536.0,"Wat ontzettend leuk, precies wat ik zoek! Ik ga mij aanmelden🤗",comment,reddit,,2
1huusz9,1736160921.0,Is there also WH40k?,comment,reddit,,4
1huusz9,1736155824.0,Thank you!,comment,reddit,,3
1huusz9,1736162556.0,I might join,comment,reddit,,3
1huusz9,1736617700.0,Come join us this coming Monday for guided boardgame night with a chill and welcoming group! [https://www.meetup.com/english-boardgaming-and-rpg-meetup-group/events/305467206/?eventOrigin=group\_upcoming\_events](https://www.meetup.com/english-boardgaming-and-rpg-meetup-group/events/305467206/?eventOrigin=group_upcoming_events),comment,reddit,,1
1hotdwf,1735469397.0,"Yay, soestdijkseplein! Daar ben ik ook een keer aangereden.",comment,reddit,,23
1hotdwf,1735482077.0,Laak veiligste stukje DH,comment,reddit,,16
1hotdwf,1735479058.0,"Wacht, dit is niet r/kutautos?",comment,reddit,,11
1hotdwf,1735472917.0,[Dit kruispunt achter Den Haag HS](https://i.imgur.com/HzRpgQh.png) is al echt jaren rampzalig. Kijk gewoon naar hoe die wegen in elkaar zitten.   Maak het gewoon een tweebaans + 3e baan met eenrichtingverkeer voor invoegers/uitvoegers Leeghwaterplein.  Hier[ een aanzicht](https://i.imgur.com/zHltwnG.jpeg) van Google streetview...,comment,reddit,,22
1hotdwf,1735483319.0,"Kruising waldorpstraat / viaductweg / calandkade is echt slechts uitgedachte kruispunt ooit.   Om de een of andere reden moet rechtdoorgaand fietsverkeer op de Waldorpstraat daar oversteken, want het fietspad gaat opeens verder aan de andere kant van de straat. Sta je dan tien minuten te wachten totdat je verder kunt omdat al dat sluipverkeer dat niet via Hildebrandplein wil (snap ik ook wel, ander kut kruispunt) voor moet laten gaan.   Sowieso zou een fatsoenlijke verkeersdrempel op de Waldorpstraat wonderen doen volgens mij. Wordt ontzettend gesjeest, vooral snachts. En ja, toen het nog een industrieterrein was, ok, maar nu is het een nieuwbouwwijk.",comment,reddit,,9
1hotdwf,1735468595.0,"Yup, ik zie mijn straat en de dodelijke ongelukken zijn juist geplaatst :(. Niet best.",comment,reddit,,8
1hotdwf,1735470300.0,Goudenregenstraat/thomsonlaan kruising !!!,comment,reddit,,9
1hotdwf,1735468336.0,"Deze geeft een overzicht van ongevallen tussen 2018 en 2024 waarbij auto's en fietsers of voetgangers betrokken waren. Hier de link naar het artikel: [https://www.rtl.nl/nieuws/onderzoek/artikel/5485424/ongelukken-fietsers-voetgangers-kaart-gevaar-hotspots](https://www.rtl.nl/nieuws/onderzoek/artikel/5485424/ongelukken-fietsers-voetgangers-kaart-gevaar-hotspots)  Nav dit draadje in r/thenetherlands : [https://www.reddit.com/r/thenetherlands/comments/1hobuw9/kwart\_meer\_aanrijdingen\_met\_fietsers\_en/](https://www.reddit.com/r/thenetherlands/comments/1hobuw9/kwart_meer_aanrijdingen_met_fietsers_en/)     En wat ik daar ook schreef:   ""Een aanrijding tussen auto's en fietsers of voetgangers"". Bij de fietser (en voetganger) gaat het om de persoon, bij de auto wordt alleen het object genoemd en niet de bestuurder. Ook impliceert 'aanrijding tussen' alsof het een gelijkwaardig conflict is. Dat is bij de fietser niet zo en bij de voetganger al helemaal niet.  De zin zou eigenlijk moeten zijn ""autobestuurders die tegen fietsers of voetgangers aanrijden"". Maar dan vinden veel mensen het niet meer leuk om te lezen natuurlijk.",comment,reddit,,14
1hotdwf,1735491576.0,Het pijnigt me om te zien dat het inlegkruispunt op deze kaart staat :(,comment,reddit,,1
1hotdwf,1735506293.0,Ik ben op het kruispunt van de oude haagweg aangereden bij de snackbar en op de rotonde van de snelweg. Op de rotonde werd ik aangereden door een vrouw die onderweg was naar een garage daar nadat ze eerder die dag ook iemand had aangereden.,comment,reddit,,1
1hotdwf,1735530019.0,Dus overal?,comment,reddit,,1
1hotdwf,1735543328.0,Yess ik woon in het ene stukje waar niks gebeurt,comment,reddit,,1
1hotdwf,1735604779.0,Dacht eerst dat dit een kaart was met gevaarlijke plekken om de auto neer te zetten met Oud en Nieuw haha,comment,reddit,,1
1hotdwf,1735472665.0,"Ik vind dit een heel eigenaardig onderwerp. Er is een constante stroom van nieuws over dodelijke ongevallen, men klaagt er steen en been over en toch merk ik er helemaal niks van. Ik woon hier onafgebroken sinds mijn geboorte (20 jaar) en heb nog nooit van mijn leven zo’n verkeersongeluk zien gebeuren. Er bestaat bij mij geen twijfel over of deze ongelukken wel of niet gebeuren, maar de gevolgen ontgaan mij.  Zijn er hier mensen met vergelijkbare ervaringen? Of ben ik gewoon stekeblind?",comment,reddit,,1
1hotdwf,1735479395.0,Kan aan mij liggen maar een hoop kruispunten die hier op staan zijn gewoon overzichtelijk en veilig.. niet allemaal maar wel een hoop.,comment,reddit,,0
1gwn3pq,1732215258.0,"""Hi. Automoderator has detected that you may be asking for a place to live or advice regarding housing in The Hague. We know it’s tough. Questions like these get asked very often in this subreddit. Please post in our monthly thread regarding these issues (or use the search function to find earlier posts).   *I am a bot, and this action was performed automatically. Please [contact the moderators of this subreddit](/message/compose/?to=/r/TheHague) if you have any questions or concerns.*",comment,reddit,,1
1gwn3pq,1732307392.0,[deleted],comment,reddit,,1
1gwn3pq,1732993148.0,If your toddler more then 2 years old then better buy seat booster for €20 in prenatal or hema.,comment,reddit,,1
1gwn3pq,1732224339.0,What kind of baby weighs 23kg ![gif](emote|free_emotes_pack|neutral_face),comment,reddit,,-1
1go6btm,1731264929.0,"&gt; Laak staat niet heel positief op de kaart, maar op de rand van Rijswijk schijnt het best oké te zijn.   Dat is ook mijn ervaring. Laak is niet de fijnste wijk van Den Haag, maar je hoeft je er niet onveilig te voelen. Het klopt dat er nu veel arbeidsmigranten wonen, en ook veel studenten, maar ik heb ook steeds meer vrienden die in Laak een huis kopen of wonen. Dat alleen geeft al aan dat er een zekere mate van gentrificatie plaats vindt. Daar vind ik zelf wat van, maar dat betekent voor jou dat het in de toekomst waarschijnlijk wel netter en rustiger zou kunnen worden. Rijswijk zelf is wel heel stil en rustig.  &gt; Vrienden van mij wonen in Delft, is dit een veilige fietsroute zo rond middernacht?  Ik woon zelf meer naar het noord-oosten dus ik neem altijd de fietsroute naar Delft langs het Schie en die vind ik heel veilig, want de route is de hele weg goed verlicht. Maar de snelste route vanaf de Sinjeur Semeynsweg heeft geloof ik ook geen onverlichte stukken.",comment,reddit,,13
